"https://www.jstor.org/stable/2712673","The Family, the State, and the Novel in the Early Republic"
"https://www.jstor.org/stable/2712674","Race Relations in the American West"
"https://www.jstor.org/stable/2712675","Melting Plots: Patterns of Racial and Ethnic Amalgamation in American Drama before Eugene O'Neill"
"https://www.jstor.org/stable/2712676","Theories of Ethnic Humor: How to Enter, Laughing"
"https://www.jstor.org/stable/2712677","Separate Confrontations: Gender as a Factor in Indian Adaptation to European Colonization in New France"
"https://www.jstor.org/stable/2712678","The Enduring Black Jeremiad: The American Jeremiad and Black Protest Rhetoric, from Frederick Douglass to W. E. B. Du Bois, 1841-1919"
"https://www.jstor.org/stable/2712682","Doctoral Dissertations in American Studies, 1985-86"
"https://www.jstor.org/stable/2712686","National Mood and American Foreign Policy: A Suggestive Essay"
"https://www.jstor.org/stable/2712687","Walt Whitman and Mannahatta-New York"
"https://www.jstor.org/stable/2712688","Ahab and Ishmael at War: The Presence of Moby-Dick in the Naked and the Dead"
"https://www.jstor.org/stable/2712689","False Sympathy in Melville's Typee"
"https://www.jstor.org/stable/2712690","Vietnam and the Hollywood Genre Film: Inversions of American Mythology in the Deer Hunter and Apocalypse Now"
"https://www.jstor.org/stable/2712694","The Glamorous Crowd: Hollywood Movie Premieres Between the Wars"
"https://www.jstor.org/stable/2712695","Horace Bushnell's Philosophy of Language Considered as a Mode of Cultural Criticism"
"https://www.jstor.org/stable/2712696","Women, Reading, and Cultural Authority: Some Implications of the Audience Perspective in Cultural Studies"
"https://www.jstor.org/stable/2712697","Robert Carter's Journey: From Colonial Patriarch to New Nation Mystic"
"https://www.jstor.org/stable/2712698","The Moral Origins of Political Surveillance: The Preventive Society in New York City, 1867-1918"
"https://www.jstor.org/stable/2712724","Ex-Slave Interviews and the Historiography of Slavery"
"https://www.jstor.org/stable/2712725","Problems of Class and Race in the Origins of the Mass Circulation Press"
"https://www.jstor.org/stable/2712726","Varieties of Paternalism: Industrial Structures and the Social Relations of Production in American Textiles"
"https://www.jstor.org/stable/2712727","&quot;Oh That I Was a Soldier&quot;: John Adams and the Anguish of War"
"https://www.jstor.org/stable/2712728","The Dynamics of History and Fiction in Melville's Typee"
"https://www.jstor.org/stable/2712737","World War II and the Development of American Studies"
"https://www.jstor.org/stable/2712738","The Roots of Tara: Making War Civil"
"https://www.jstor.org/stable/2712739","The American Literature of War: The Civil War, World War I, and World War II"
"https://www.jstor.org/stable/2712740","The &quot;New&quot; American Military History: A Map of the Territory, Explored and Unexplored"
"https://www.jstor.org/stable/2712743","American Studies Research in Progress, 1984-85"
"https://www.jstor.org/stable/2712747","&quot;Heroes of the Engine Room&quot;: American &quot;Civilization&quot; and the War with Spain"
"https://www.jstor.org/stable/2712748","Getting in the Kitchen with Dinah: Domestic Politics in Uncle Tom's Cabin"
"https://www.jstor.org/stable/2712749","Curiosities Too Numerous to Mention: Early Regionalism and Cincinnati's Western Museum"
"https://www.jstor.org/stable/2712760","English Satire and Connecticut Wit"
"https://www.jstor.org/stable/2712761","The Importance of Mark Twain"
"https://www.jstor.org/stable/2712762","The Record of Political Humor"
"https://www.jstor.org/stable/2712763","Standup Comedy as Social and Cultural Mediation"
"https://www.jstor.org/stable/2712764","Ethnic Humor: Subversion and Survival"
"https://www.jstor.org/stable/2712765","Humor and Gender Roles: The &quot;Funny&quot; Feminism of the Post-World War II Suburbs"
"https://www.jstor.org/stable/2712766","Richard Nixon as a Comic Figure"
"https://www.jstor.org/stable/2712776","The Ethnography of Everyday Life: Theories and Methods for American Culture Studies"
"https://www.jstor.org/stable/2712777","The View from New England: Notes on Everyday Life in Rural America to 1850"
"https://www.jstor.org/stable/2712780","Living History: Simulating Everyday Life in Living Museums"
"https://www.jstor.org/stable/2712790","A Postmortem on Daniel Bell's Postindustrialism"
"https://www.jstor.org/stable/2712799","Savage, Sinner, and Saved: Davy Crockett, Camp Meetings, and the Wild Frontier"
"https://www.jstor.org/stable/2712800","The Cherokee Nation: Mirror of the Republic"
"https://www.jstor.org/stable/2712802","History from the Inside-Out: Writing the History of Women in Rural America"
"https://www.jstor.org/stable/2712803","Vigilance and the Law: The Moral Authority of Popular Justice in the Far West"
"https://www.jstor.org/stable/2712805","Nostalgia and Progress: Theodore Roosevelt's Myth of the Frontier"
"https://www.jstor.org/stable/2712811","Dr. Benjamin Franklin's Celestial Telegraph, or Indian Blessings to Gas-Lit American Drawing Rooms"
"https://www.jstor.org/stable/2712812","Mercy Otis Warren: The Politics of Language and the Aesthetics of Self"
"https://www.jstor.org/stable/2712813","&quot;Information, Please!&quot;: Culture and Expertise in the Interwar Period"
"https://www.jstor.org/stable/2712814","The Quest for the Ultimate Shiksa"
"https://www.jstor.org/stable/2712820","Law, Sex, Cruelty, and Divorce in Victorian America, 1840-1900"
"https://www.jstor.org/stable/2712821","The Engineer as Cultural Hero and Willa Cather's First Novel, Alexander's Bridge"
"https://www.jstor.org/stable/2712822","From New York to Middletown: Repeal and the Legitimization of Nightlife in the Great Depression"
"https://www.jstor.org/stable/2712823","Timid Girls, Venerable Widows and Dignified Matrons: Life Cycle Patterns Among Organized Women in New York and Boston, 1797-1840"
"https://www.jstor.org/stable/2712824","Caps and Chains: Hiram Powers' Statue of &quot;Liberty&quot;"
"https://www.jstor.org/stable/2712825","&quot;Behold a Tragic Scene Strangely Changed into a Theater of Mercy&quot;: The Structure and Significance of Criminal Conversion Narratives in Early New England"
"https://www.jstor.org/stable/2712837","Surveillance in the Academy: Harry B. Fisher and Yale University, 1927-1952"
"https://www.jstor.org/stable/2712838","From New Criticism to Deconstruction: The Example of Charles Feidelson's Symbolism and American Literature"
"https://www.jstor.org/stable/2712839","Notes on the Judeo-Christian Tradition in America"
"https://www.jstor.org/stable/2712840","The Pioneers, or the Sources of American Legal History: A Critical Tale"
"https://www.jstor.org/stable/2712841","Working Girls Unite"
"https://www.jstor.org/stable/2712849","To the Edges of Ideology: Margaret Fuller's Centrifugal Evolution"
"https://www.jstor.org/stable/2712850","The Character of Washington: A Study in Republican Culture"
"https://www.jstor.org/stable/2712851","The Hidden Hand: Subversion of Cultural Ideology in Three Mid-Nineteenth-Century American Women's Novels"
"https://www.jstor.org/stable/2712852","Social Sources of Denominationalism Reconsidered: Post-Revolutionary Boston as a Case Study"
"https://www.jstor.org/stable/2712853","Religion and Labor Reform in Antebellum America: The World of William Field Young"
"https://www.jstor.org/stable/2712864","Masterpiece Theater: The Politics of Hawthorne's Literary Reputation"
"https://www.jstor.org/stable/2712865","The Rationale for Restriction: Ethnicity and College Admission in America, 1910-1980"
"https://www.jstor.org/stable/2712866","The Great Chicago Fire as a National Event"
"https://www.jstor.org/stable/2712867","Ancient Africa and the Early Black American Historians, 1883-1915"
"https://www.jstor.org/stable/2712875","The Singing Tree: Dynamics of a Yaqui Myth"
"https://www.jstor.org/stable/2712876","Antibolshevism and American Foreign Policy, 1919-1939: The Diplomacy of Self-Delusion"
"https://www.jstor.org/stable/2712877","Tammany: The Indian as Rhetorical Surrogate"
"https://www.jstor.org/stable/2712878","The Naval Reform Campaign Against Flogging: A Case Study in Changing Attitudes Toward Corporal Punishment, 1830-1850"
"https://www.jstor.org/stable/2712883","Critical Provincialism: Poe's Poetic Principle in Antebellum Context"
"https://www.jstor.org/stable/2712884","Spies, National Security, and the &quot;Inertia Projector&quot;: The Secret Service Films of Ronald Reagan"
"https://www.jstor.org/stable/2712885","Lewis Hine: From &quot;Social&quot; to &quot;Interpretive&quot; Photographer"
"https://www.jstor.org/stable/2712886","Sculling to the Over-Soul: Louis Simpson, American Transcendentalism, and Thomas Eakins's &quot;Max Schmitt in a Single Scull&quot;"
"https://www.jstor.org/stable/2712887","The American Image of Technology From the Revolution to 1840"
"https://www.jstor.org/stable/2712897","Single Mothers and Child Neglect, 1880-1920"
"https://www.jstor.org/stable/2712898","Emerson and the Luminist Painters: A Study of Their Styles"
"https://www.jstor.org/stable/2712899","Common Sense Traditions and American Evangelical Thought"
"https://www.jstor.org/stable/2712900","Frugality or Comfort: Middle-Class Styles of Life in the Early Twentieth Century"
"https://www.jstor.org/stable/2712901","Black English in Early Blackface Minstrelsy: A New Interpretation of the Sources of Minstrel Show Dialect"
"https://www.jstor.org/stable/2712909","The Parabolic Ploys of the Scarlet Letter"
"https://www.jstor.org/stable/2712910","The Gibson Girl Goes to College: Popular Culture and Women's Higher Education in the Progressive Era, 1890-1920"
"https://www.jstor.org/stable/2712911","Thoreau's Enterprise of Self-Culture in a Culture of Enterprise"
"https://www.jstor.org/stable/2712912","A Virtuous Affair: The Correspondence Between Abigail Adams and James Lovell"
"https://www.jstor.org/stable/2712913","Toward a Consumer Culture: &quot;Adirondack Murray&quot; and the Wilderness Vacation"
"https://www.jstor.org/stable/2712923","Caroline F. Ware and the Cultural Approach to History"
"https://www.jstor.org/stable/2712924","Black Womanhood in Nineteenth-Century America: Subversion and Self-Construction in Two Women's Autobiographies"
"https://www.jstor.org/stable/2712925","&quot;The Seeming Counterfeit&quot;: Racial Politics and Early Blackface Minstrelsy"
"https://www.jstor.org/stable/2712928","Economics and Culture: Opening Up the Rural History of the Early American Northeast"
"https://www.jstor.org/stable/2712939","The Politics of American Studies"
"https://www.jstor.org/stable/2712940","Making it Really New: Hilda Doolittle, Gwendolyn Brooks, and the Feminist Potential of Modern Poetry"
"https://www.jstor.org/stable/2712941","A Natural History of the Gloucester Sea Serpent: Knowledge, Power, and the Culture of Science in Antebellum America"
"https://www.jstor.org/stable/2712942","Puerto Rican Studies"
"https://www.jstor.org/stable/2712952","The Recovery of Chicano Nineteenth-Century Autobiography"
"https://www.jstor.org/stable/2712953","&quot;Peaceable Fruits&quot;: The Ministry of Harriet Beecher Stowe"
"https://www.jstor.org/stable/2712954","American Art and Labor: The Case of Anshutz's &quot;The Ironworkers' Noontime&quot;"
"https://www.jstor.org/stable/2712955","Timothy Dwight 'Composes' a Landscape for New England"
"https://www.jstor.org/stable/2712956","The Social and Political Base of Millennial Literature in Late Eighteenth-Century America"
"https://www.jstor.org/stable/2712964","Women and the Republic: Emma Willard's Rhetoric of History"
"https://www.jstor.org/stable/2712965","&quot;Kodakers Lying in Wait&quot;: Amateur Photography and the Right of Privacy in New York, 1885-1915"
"https://www.jstor.org/stable/2712966","Progressive Visions of War in &quot;The Red Badge of Courage&quot; and &quot;The Principles of Scientific Management&quot;"
"https://www.jstor.org/stable/2712979","Cultural Locations: Positioning American Studies in the Great Debate"
"https://www.jstor.org/stable/2712980","The Religious Boundaries of an Inbetween People: Street Feste and the Problem of the Dark-Skinned Other in Italian Harlem, 1920-1990"
"https://www.jstor.org/stable/2712981","Optimism of the Mind: Imagining Postindustrial Society in the 1960s and 1970s"
"https://www.jstor.org/stable/2712982","Edgar Allan Poe and the Horrid Laws of Political Economy"
"https://www.jstor.org/stable/2712996","&quot;Art&quot; and the Language of Progress in Early-Industrial Paterson: Sam Patch at Clinton Bridge"
"https://www.jstor.org/stable/2712997","Shaping the Popular Image of Post-Reconstruction American Blacks: The &quot;Coon Song&quot; Phenomenon of the Gilded Age"
"https://www.jstor.org/stable/2712998","&quot;Through the Cracked and Fragmented Self&quot;: William James and The Turn of the Screw"
"https://www.jstor.org/stable/2712999","&quot;Old Words&quot; in &quot;New Circumstances&quot;: Language and Leadership in Post-Revolutionary America"
"https://www.jstor.org/stable/2713000","The Americanization of Tevye or Boarding the Jewish &quot;Mayflower&quot;"
"https://www.jstor.org/stable/2713014","Of Mules and Mares in a Land of Difference; or, Quadrupeds All?"
"https://www.jstor.org/stable/2713015","A Convergence of Vision: Constance Rourke, Charles Sheeler, and American Art"
"https://www.jstor.org/stable/2713016","The Uses of Catastrophism: Lewis Mumford, Vernon L. Parrington, Van Wyck Brooks, and the End of American Regionalism"
"https://www.jstor.org/stable/2713017","Boasian Anthropology and the Critique of American Culture"
"https://www.jstor.org/stable/2713018","Two Beards: Coauthorship and the Concept of Civilization"
"https://www.jstor.org/stable/2713019","The Political Uses of Alienation: W. E. B. Du Bois on Politics, Race, and Culture, 1903-1940"
"https://www.jstor.org/stable/2713020","Lionel Trilling and American Culture"
"https://www.jstor.org/stable/2713023","Religion, Secularization, and the Shaping of the Culture Industry in Antebellum America"
"https://www.jstor.org/stable/2713024","&quot;The First Man was Red&quot;--Cherokee Responses to the Debate Over Indian Origins, 1760-1860"
"https://www.jstor.org/stable/2713025","Native American &quot;Texts&quot; and the Problem of Authenticity"
"https://www.jstor.org/stable/2713026","In the Name of Wonder: The Emergence of Tall Narrative in American Writing"
"https://www.jstor.org/stable/2713027","The Social World of Salem: William King's 1681 Blasphemy Trial"
"https://www.jstor.org/stable/2713029","Matthiessen's American Renaissance: Circumscribing the Revolution"
"https://www.jstor.org/stable/2713039","Phillis Wheatley and Literary Americanization"
"https://www.jstor.org/stable/2713040","Morals, Manners, and the Republican Mother"
"https://www.jstor.org/stable/2713041","&quot;A Silent Exile on this Earth&quot;: The Metaphorical Construction of Deafness in the Nineteenth Century"
"https://www.jstor.org/stable/2713051","The Problem of American Exceptionalism: A Reconsideration"
"https://www.jstor.org/stable/2713052","Community, Patriarchy and Individualism: The Politics of Chicano History and the Dream of Equality"
"https://www.jstor.org/stable/2713053","Reading and Ambition: M. Carey Thomas and Female Heroism"
"https://www.jstor.org/stable/2713054","On the Margins: The State of American Catholic History"
"https://www.jstor.org/stable/2713064","Susan Fenimore Cooper and the Plain Daughters of America"
"https://www.jstor.org/stable/2713065","In Defense of the Gallows: Justifications of Capital Punishment in New England Execution Sermons, 1674-1825"
"https://www.jstor.org/stable/2713066","Suburban Men and Masculine Domesticity, 1870-1915"
"https://www.jstor.org/stable/2713067","Sovereign Individuals and Organic Networks: Political Cultures in Conflict During the Progressive Era"
"https://www.jstor.org/stable/2713068","The Trivialization of American Literature"
"https://www.jstor.org/stable/2713081","The Purple Rose of Popular Culture Theory: An Exploration of Intellectual Kitsch"
"https://www.jstor.org/stable/2713082","The Musical World of Doctorow's Ragtime"
"https://www.jstor.org/stable/2713083","&quot;Our Singing Country&quot;: John and Alan Lomax, Leadbelly, and the Construction of an American Past"
"https://www.jstor.org/stable/2713084","The Idiocy of American Studies: Poststructuralism, Language, and Politics in the Age of Self-Fulfilment"
"https://www.jstor.org/stable/2713090","Doctoral Dissertations in American Studies, 1990-1991"
"https://www.jstor.org/stable/2713094","A New Context for a New American Studies?"
"https://www.jstor.org/stable/2713095","Intemperate Men, Spiteful Women, and Jefferson Davis: Northern Views of the Defeated South"
"https://www.jstor.org/stable/2713096","&quot;A Certain Restless Ambition&quot;: Women Physicians and World War I"
"https://www.jstor.org/stable/2713105","Doctoral Dissertations in American Studies, 1988-1989"
"https://www.jstor.org/stable/2713108","Working the Levees: Building Them Up or Knocking Them Down?"
"https://www.jstor.org/stable/2713109","Minorities (Almost) All: The Minority Concept in American Social Thought"
"https://www.jstor.org/stable/2713110","(Re)Collecting the Past: Writing Native American Speech"
"https://www.jstor.org/stable/2713113","C. L. R. James: A Radical West Indian Vision of American Studies"
"https://www.jstor.org/stable/2713122","Margaret Fuller as Cultural Reformer: The Conversations in Boston"
"https://www.jstor.org/stable/2713124","The Scarlet Letter in China"
"https://www.jstor.org/stable/2713125","Wish Fulfillment in the Wilderness: D. H. Lawrence and the Leatherstocking Tales"
"https://www.jstor.org/stable/2713126","Learning from the Banana"
"https://www.jstor.org/stable/2713127","&quot;A Very Peculiar Sorrow&quot;: Attitudes Toward Infant Death in the Urban Northeast, 1800-1860"
"https://www.jstor.org/stable/2713135","Doctoral Dissertations in American Studies, 1986-87"
"https://www.jstor.org/stable/2713140","Literacy Instruction and Gender in Colonial New England"
"https://www.jstor.org/stable/2713141","A Republican Literature: A Study of Magazine Reading and Readers in Late Eighteenth-Century New York"
"https://www.jstor.org/stable/2713142","Antebellum Reading and the Ironies of Technological Innovation"
"https://www.jstor.org/stable/2713143","Moving on Down the Line"
"https://www.jstor.org/stable/2713144","Becoming Noncanonical: The Case Against Willa Cather"
"https://www.jstor.org/stable/2713148","Diversity and the Transformation of American Studies"
"https://www.jstor.org/stable/2713149","&quot;The Women Have Had Charge of the Church Work Long Enough&quot;: The Men and Religion Forward Movement of 1911-1912 and the Masculinization of Middle-Class Protestantism"
"https://www.jstor.org/stable/2713150","Containing Multitudes: Realism, Historicism, American Studies"
"https://www.jstor.org/stable/2713152","The Machine-Readable Transcendentalists: Cultural History on the Computer"
"https://www.jstor.org/stable/2713164","&quot;The Bloody Hand&quot; of Labor: Work, Class, and Gender in Three Stories by Hawthorne"
"https://www.jstor.org/stable/2713165","Widening the World: Susan Warner, Her Readers, and the Assumption of Authorship"
"https://www.jstor.org/stable/2713166","&quot;I Want a Girl, Just Like the Girl that Married Harry James&quot;: American Women and the Problem of Political Obligation in World War II"
"https://www.jstor.org/stable/2713167","Listening to Learn and Learning to Listen: Popular Culture, Cultural Theory, and American Studies"
"https://www.jstor.org/stable/2713174","Doctoral Dissertations in American Studies, 1989-1990"
"https://www.jstor.org/stable/2713178","Republic of Humbug: The Russian Nativist Critique of the United States, 1830-1930"
"https://www.jstor.org/stable/2713179","&quot;Our Native Clay&quot;: Racial and Sexual Identity and the Making of Americans in The Bridge"
"https://www.jstor.org/stable/2713180","Inscribing the Self in the Heart of the Family: Diaries and Girlhood in Late-Victorian America"
"https://www.jstor.org/stable/2713182","Reviewing America: John Crowe Ransom's Kenyon Review"
"https://www.jstor.org/stable/2713191","Encountering Mass Culture at the Grassroots: The Experience of Chicago Workers in the 1920s"
"https://www.jstor.org/stable/2713192","&quot;In a Different Voice&quot;: Male and Female Narratives of Religious Conversion in Post-Revolutionary America"
"https://www.jstor.org/stable/2713193","Visual Autobiography: Photograph Albums of Turn-of-the-Century Midwestern Women"
"https://www.jstor.org/stable/2713194","Theodore Roosevelt, Brander Matthews, and the Campaign for Literary Americanism"
"https://www.jstor.org/stable/2713213","Introduction: Hollywood, Censorship, and American Culture"
"https://www.jstor.org/stable/2713214","The Politics of Performance: From Theater Licensing to Movie Censorship in Turn-of-the-Century New York"
"https://www.jstor.org/stable/2713215","&quot;To Prevent the Prevalent Type of Book&quot;: Censorship and Adaptation in Hollywood, 1924-1934"
"https://www.jstor.org/stable/2713216","Hollywood, Main Street, and the Church: Trying to Censor the Movies Before the Production Code"
"https://www.jstor.org/stable/2713217","Foreign Parts: Hollywood's Global Distribution and the Representation of Ethnicity"
"https://www.jstor.org/stable/2713219","Doctoral Dissertations in American Studies, 1991-1992"
"https://www.jstor.org/stable/2713223","Between Individualism and Fragmentation: American Culture and the New Literary Studies of Race and Gender"
"https://www.jstor.org/stable/2713224","The Puritan Captivity Narrative and the Politics of the American Revolution"
"https://www.jstor.org/stable/2713225","Into the Cultural Mainstream: The Growth of American Music Scholarship"
"https://www.jstor.org/stable/2713238","Assimilationist Minstrelsy as Racial Uplift Ideology: James D. Corrothers's Literary Quest for Black Leadership"
"https://www.jstor.org/stable/2713239","Strategies and Revisions of Self-Representation in Booker T. Washington's Autobiographies"
"https://www.jstor.org/stable/2713240","&quot;Precepts Graven on Every Breast&quot;: Melville's Typee and the Forms of the Law"
"https://www.jstor.org/stable/2713251","Multiculturalism and Universalism: A History and Critique"
"https://www.jstor.org/stable/2713258","To Deconstruct Race, Deconstruct Whiteness"
"https://www.jstor.org/stable/2713268","&quot;The Break-Through to New Life&quot;: Christianity and the Emergence of the New Left in Austin, Texas, 1956-1964"
"https://www.jstor.org/stable/2713269","Losing the World of Tomorrow: The Battle Over the Presentation of Science at the 1939 New York World's Fair"
"https://www.jstor.org/stable/2713270","Bowery B'hoys and Matinee Ladies: The Re-Gendering of Nineteenth-Century American Theater Audiences"
"https://www.jstor.org/stable/2713271","The Boundaries of Memory: The United States Holocaust Memorial Museum"
"https://www.jstor.org/stable/2713279","&quot;Versions of Nashville, Visions of American Studies&quot;: Presidential Address to the American Studies Association, October 27, 1994"
"https://www.jstor.org/stable/2713280","Douglas Tilden's Mechanics Fountain: Labor and the &quot;Crisis of Masculinity&quot; in the 1890s"
"https://www.jstor.org/stable/2713281","Religion, Culture, and the Politics of Class: Alexander Irvine's Mission to Turn-of-the-Century New Haven"
"https://www.jstor.org/stable/2713282","Hawthorne's Genealogy of Madness: &quot;The House of Seven Gables&quot; and Disciplinary Individualism"
"https://www.jstor.org/stable/2713291","The Possessive Investment in Whiteness: Racialized Social Democracy and the &quot;White&quot; Problem in American Studies"
"https://www.jstor.org/stable/2713296","Interrogating &quot;Whiteness,&quot; Complicating &quot;Blackness&quot;: Remapping American Culture"
"https://www.jstor.org/stable/2713297","The American Paradox: Jeffersonian Equality and Racial Science"
"https://www.jstor.org/stable/2713298","The Irony of Identity: An Essay on Nativism, Liberal Democracy, and Parochial Identities in Canada and the United States"
"https://www.jstor.org/stable/2713307","&quot;The Hand of Refined Taste&quot; in the Frontier Landscape: Caroline Kirkland's &quot;A New Home, Who'll Follow?&quot; and the Feminization of American Consumerism"
"https://www.jstor.org/stable/2713308","&quot;All Things to All Men&quot;: The Commercial Traveler and the Rise of Modern Salesmanship"
"https://www.jstor.org/stable/2713309","Garrisonian Abolitionists and the Rhetoric of Gender, 1850-1860"
"https://www.jstor.org/stable/2713320","Doctoral Dissertations in American Studies, 1992-1993"
"https://www.jstor.org/stable/2713323","Temperance in the Bed of a Child: Incest and Social Order in Nineteenth-Century America"
"https://www.jstor.org/stable/2713324","Choosing a Medium: Margaret Fuller and the Forms of Sentiment"
"https://www.jstor.org/stable/2713325","Reframing the Bicycle: Advertising-Supported Magazines and Scorching Women"
"https://www.jstor.org/stable/2713326","What Next? Thought and Action in Intellectual Work"
"https://www.jstor.org/stable/2713335","&quot;Loose Change&quot;: Presidential Address to the American Studies Association, November 4, 1993"
"https://www.jstor.org/stable/2713336","Thorstein Veblen and the Rhetoric of Authority"
"https://www.jstor.org/stable/2713337","Bootlegging Mothers and Drinking Daughters: Gender and Prohibition in Butte, Montana"
"https://www.jstor.org/stable/2713338","&quot;The Hearts of Your Readers will Shudder&quot;: Fanny Wright, Infidelity, and American Freethought"
"https://www.jstor.org/stable/2713349","Bold New City or Built-Up 'Burb? Redefining Contemporary Suburbia"
"https://www.jstor.org/stable/2713355","Outside Looking in: Nonnatives and American Indian Literature"
