"https://www.jstor.org/stable/2713367","Ethnicity, Literary Theory, and the Grounds of Resistance"
"https://www.jstor.org/stable/2713368","&quot;Masculinity&quot; in Uncle Tom's Cabin"
"https://www.jstor.org/stable/2713369","Internment and Identity in Japanese American Art"
"https://www.jstor.org/stable/2713370","A World Made Safe for Differences: Ruth Benedict's &quot;The Chrysanthemum and the Sword&quot;"
"https://www.jstor.org/stable/2713371","Healthful Employment: Hawthorne, Thoreau, and Middle-Class Fitness"
"https://www.jstor.org/stable/2713377","Doctoral Dissertations in American Studies, 1994-1995"
"https://www.jstor.org/stable/2713381","Dead Men Tell No Tales: John Sassamon and the Fatal Consequences of Literacy"
"https://www.jstor.org/stable/2713382","Racial Essentialism and Family Values in &quot;Uncle Tom's Cabin&quot;"
"https://www.jstor.org/stable/2713383","Heroes and Misfits: The Troubled Social Reintegration of Disabled Veterans in &quot;The Best Years of Our Lives&quot;"
"https://www.jstor.org/stable/2713384","On Multiculturalism and Privilege: A Latina Perspective"
"https://www.jstor.org/stable/2713391","Doctoral Dissertations in American Studies, 1993-1994"
"https://www.jstor.org/stable/27734972","Broadway and Main: Crossroads, Ghost Roads, and Paths to an American Studies Future"
"https://www.jstor.org/stable/27734975","The Ruse of Engagement: Black Masculinity and the Cinema of Policing"
"https://www.jstor.org/stable/27734976","&quot;You Should Give them Blacks to Eat:&quot; Waging Inter-American Wars of Torture and Terror"
"https://www.jstor.org/stable/27734977","&quot;Our Battle Cry Will Be: Remember Jenny McCrea!&quot; A Prcis on the Rhetoric of Revenge"
"https://www.jstor.org/stable/27734978","Domesticating the Aliens Within: Sentimental Benevolence in Late-Nineteenth-Century California Magazines"
"https://www.jstor.org/stable/27734988","&quot;Circular Reasoning&quot;: Recentering Cherokee Women in the Antiremoval Campaigns"
"https://www.jstor.org/stable/27734989","&quot;Blacks in All Quarters of the Globe&quot;: Anti-Imperialism, Insurgent Cosmopolitanism, and International Labor in Pauline Hopkins's Literary Journalism"
"https://www.jstor.org/stable/27734990","&quot;You Ain't Seen Nothin' Yet&quot;: &quot;Beloved,&quot; the American Chain Gang, and the Middle Passage Remix"
"https://www.jstor.org/stable/27734991","Black Children, White Preference: Brown v. Board, the Doll Tests, and the Politics of Self-Esteem"
"https://www.jstor.org/stable/27734992","The Game Theory Narrative and the Myth of the National Security State"
"https://www.jstor.org/stable/27734993","Picture Revolution: Transnationalism, American Studies, and the Politics of Contemporary Native Culture"
"https://www.jstor.org/stable/27735002","Introduction: Katrina's World: Blues, Bourbon, and the Return to the Source"
"https://www.jstor.org/stable/27735003","&quot;More Desultory and Unconnected than Any Other&quot;: Geography, Desire, and Freedom in Eliza Potter's &quot;A Hairdresser's Experience in High Life&quot;"
"https://www.jstor.org/stable/27735004","&quot;Justice Mocked&quot;: Violence and Accountability in New Orleans"
"https://www.jstor.org/stable/27735005","Beyond Disaster Exceptionalism: Social Movement Developments in New Orleans after Hurricane Katrina"
"https://www.jstor.org/stable/27735006","Stories at the Center: Story Circles, Educational Organizing, and Fate of Neighborhood Public Schools in New Orleans"
"https://www.jstor.org/stable/27735007","Of Armed Guards and Kente Cloth: Afro-Creole Catholics and the Battle for St. Augustine Parish in Post-Katrina New Orleans"
"https://www.jstor.org/stable/27735009","Jazz and Revival"
"https://www.jstor.org/stable/27735010","Second Lining Post-Katrina: Learning Community from the Prince of Wales Social Aid and Pleasure Club"
"https://www.jstor.org/stable/27735012","On Conjuring Mahalia: Mahalia Jackson, New Orleans, and the Sanctified Swing"
"https://www.jstor.org/stable/27735013","&quot;My FEMA People&quot;: Hip-Hop as Disaster Recovery in the Katrina Diaspora"
"https://www.jstor.org/stable/27735014","&quot;We Know This Place&quot;: Neoliberal Racial Regimes and the Katrina Circumstance"
"https://www.jstor.org/stable/27735016","Katrina Tourism and a Tale of Two Cities: Visualizing Race and Class in New Orleans"
"https://www.jstor.org/stable/27735017","&quot;Roots Run Deep Here&quot;: The Construction of Black New Orleans in Post-Katrina Tourism Narratives"
"https://www.jstor.org/stable/27735018","Les Misrables of New Orleans: Trap Economics and the Asset Stripping Blues, Part 1"
"https://www.jstor.org/stable/27735020","After Katrina: Racial Regimes and Human Development Barriers in the Gulf Coast Region"
"https://www.jstor.org/stable/27735027","The Borders and Limits of American Studies: A Picture from Beirut"
"https://www.jstor.org/stable/27735028","An &quot;Orphan&quot; with Two Mothers: Transnational and Transracial Adoption, the Cold War, and Contemporary Asian American Cultural Politics"
"https://www.jstor.org/stable/27735029","Interlopers in the Realm of High Culture: &quot;Music Moms&quot; and the Performance of Asian and Asian American Identities"
"https://www.jstor.org/stable/27735030","The Ecological Landscapes of Jane Jacobs and Rachel Carson"
"https://www.jstor.org/stable/30041520","Rethinking Betty Friedan and the Feminine Mystique: Labor Union Radicalism and Feminism in Cold War America"
"https://www.jstor.org/stable/30041521","Marcus Garvey, Father Divine and the Gender Politics of Race Difference and Race Neutrality"
"https://www.jstor.org/stable/30041522","What the Four Million Bought: Cheap Oil Paintings of the 1880s"
"https://www.jstor.org/stable/30041534","&quot;The Radical Roots of American Studies&quot;: Presidential Address to the American Studies Association, November 9, 1995"
"https://www.jstor.org/stable/30041535","The Transformation of Culture: Three Chinese Views of America"
"https://www.jstor.org/stable/30041536","Coming of Age, but Not in Samoa: Reflections on Margaret Mead's Legacy for Western Liberal Feminism"
"https://www.jstor.org/stable/30041537","Stephen Crane and the Police"
"https://www.jstor.org/stable/30041538","American Studies: A Not so Unscientific Method"
"https://www.jstor.org/stable/30041549","Both Sides of the Veil: Race, Science, and Mysticism in W. E. B. Du Bois"
"https://www.jstor.org/stable/30041550","Books, Reading, and the World of Goods in Antebellum New England"
"https://www.jstor.org/stable/30041551","&quot;Of Thee I Sing&quot;: Contesting &quot;America&quot;"
"https://www.jstor.org/stable/30041552","Denominated &quot;SAVAGE&quot;: Methodism, Writing, and Identity in the Works of William Apess, a Pequot"
"https://www.jstor.org/stable/30041561","Doctoral Dissertations in American Studies, 1995-1996"
"https://www.jstor.org/stable/30041565","Textbooks and Texts from the Brooks: Inventing Scientific Authority in America"
"https://www.jstor.org/stable/30041566","A World of Difference: Constructing the &quot;Underclass&quot; in Progressive America"
"https://www.jstor.org/stable/30041567","Do-It-Yourself: Constructing, Repairing and Maintaining Domestic Masculinity"
"https://www.jstor.org/stable/30041568","Between Bodies of Knowledge There Is a Great Gulf Fixed: A Liberationist Reading of Class and Gender in Life in the Iron Mills"
"https://www.jstor.org/stable/30041581","&quot;Where Is the Real America?&quot;: Politics and Popular Consciousness in the Antebellum Era"
"https://www.jstor.org/stable/30041582","&quot;Too Many Books&quot;: Book Ownership and Cultural Identity in the 1920s"
"https://www.jstor.org/stable/30041583","The Architecture of Manners: Henry James, Edith Wharton, and the Mount"
"https://www.jstor.org/stable/30041584","Angelina Grimk's Rhetoric of Exposure"
"https://www.jstor.org/stable/30041597","&quot;Disturbing the Peace: What Happens to American Studies If You Put African American Studies at the Center?&quot;: Presidential Address to the American Studies Association, October 29, 1997"
"https://www.jstor.org/stable/30041598","Black Voices, White Bodies: The Performance of Race and Gender in &quot;How Long Brethren&quot;"
"https://www.jstor.org/stable/30041599","&quot;Give an Imitation of Me&quot;: Vaudeville Mimics and the Play of the Self"
"https://www.jstor.org/stable/30041600","&quot;You Wouldn't Want One of 'Em Dancing with Your Wife&quot;: Racialized Bodies on the Job in World War II"
"https://www.jstor.org/stable/30041601","Open Secrets: Memory, Imagination, and the Refashioning of Southern Identity"
"https://www.jstor.org/stable/30041613","Ethnography, Reform, and the Problem of the Real: James Mooney's Ghost-Dance Religion"
"https://www.jstor.org/stable/30041614","Recycled &quot;Trash&quot;: Gender and Authenticity in Country Music Autobiography"
"https://www.jstor.org/stable/30041615","The Business of Reading in Nineteenth-Century America: The New York Mercantile Library"
"https://www.jstor.org/stable/30041616","&quot;BOSTON/SOB NOT&quot;: Elegiac Performance in Early New England and Materialist Studies of the Book"
"https://www.jstor.org/stable/30041628","Doctoral Dissertations in American Studies, 1996-1997"
"https://www.jstor.org/stable/30041632","What's in a Name? Presidential Address to the American Studies Association, 20 November, 1998"
"https://www.jstor.org/stable/30041633","Chesnutt's Piazza Tales: Architecture, Race, and Memory in the Conjure Stories"
"https://www.jstor.org/stable/30041634","P. T. Barnum, Joice Heth and Antebellum Spectacles of Race"
"https://www.jstor.org/stable/30041635","Ideologies of the Anesthetic: Professionalism, Egalitarianism and the Ether Controversy"
"https://www.jstor.org/stable/30041656","Computers with Color Monitors: Disembodied Black Screen Images 1988-1996"
"https://www.jstor.org/stable/30041657","Lessons in Geography: Maps, Spellers, and Other Grammars of Nationalism in the Early Republic"
"https://www.jstor.org/stable/30041658","Victim and Victimizer: Female Fiends and Unease over Marriage in Antebellum Sensational Fiction"
"https://www.jstor.org/stable/30041659","The Blind Authoress of New York: Helen De Kroyft and the Uses of Disability in Antebellum America"
"https://www.jstor.org/stable/30041672","The Death of James Johnson"
"https://www.jstor.org/stable/30041673","McKinley at Home: How Early American Cinema Made News"
"https://www.jstor.org/stable/30041674","&quot;One Term Is as Fatuous as Another&quot;: Responses to the Armory Show Reconsidered"
"https://www.jstor.org/stable/30041683","Dissertation Abstracts 1998-1999"
"https://www.jstor.org/stable/30041687","Homosex Changes: Race, Cultural Geography, and the Emergence of the Gay"
"https://www.jstor.org/stable/30041688","Pandering in the Public Sphere: Masculinity and the Market in Horatio Alger"
"https://www.jstor.org/stable/30041689","A Wound of One's Own: Louisa May Alcott's Civil War Fiction"
"https://www.jstor.org/stable/30041690","Resituating American Studies in a Critical Internationalism"
"https://www.jstor.org/stable/30041792","Insiders and Outsiders: The Borders of the USA and the Limits of the ASA: Presidential Address to the American Studies Association, 31 October 1996"
"https://www.jstor.org/stable/30041793","Uncovering the Body, Discovering Ideology: Segregation and Sexual Anxiety in Lillian Smith's &quot;Killers of the Dream&quot;"
"https://www.jstor.org/stable/30041794","Queer Borders: Figures from the 1930s for U.S.-Canadian Relations"
"https://www.jstor.org/stable/30041795","Gendering the History of the Antislavery Narrative: Juxtaposing &quot;Uncle Tom's Cabin&quot; and &quot;Benito Cereno&quot;, &quot;Beloved&quot; and &quot;Middle Passage&quot;"
"https://www.jstor.org/stable/30041796","&quot;The Consummation of Rural Prosperity and Happiness&quot;: New England Agricultural Fairs and the Construction of Class and Gender, 1810-1860"
"https://www.jstor.org/stable/30041808","Constructing Race Williams: The Klan and the Making of Hard-Boiled Crime Fiction"
"https://www.jstor.org/stable/30041809","Cushing's Zuni Sketchbooks: Literature, Anthropology, and American Notions of Culture"
"https://www.jstor.org/stable/30041810","Hawthorne's Romance and the Right to Privacy"
"https://www.jstor.org/stable/30041811","An Idle Industry: Nathaniel Parker Willis and the Workings of Literary Leisure"
"https://www.jstor.org/stable/30041823","Taking Stands: American Studies at Century's End Presidential Address to the American Studies Association, October, 29 1999"
"https://www.jstor.org/stable/30041824","Served Well by Plunder: La Gran Ladronera and Producers of History Astride the Ro Grande"
"https://www.jstor.org/stable/30041825","Postcolonial Theory and the Discourse of Treaties"
"https://www.jstor.org/stable/30041826","&quot;Heroic Spiritual Grandfather&quot;: Whitman, Sexuality, and the American Left, 1890-1940"
"https://www.jstor.org/stable/30041837","The Futurama Recontextualized: Norman Bel Geddes's Eugenic &quot;World of Tomorrow&quot;"
"https://www.jstor.org/stable/30041838","The Race of Hysteria: &quot;Overcivilization&quot; and the &quot;Savage&quot; Woman in Late Nineteenth-Century Obstetrics and Gynecology"
"https://www.jstor.org/stable/30041839","Academic Viagra: The Rise of American Masculinity Studies"
"https://www.jstor.org/stable/30041856","Bronx Miracle"
"https://www.jstor.org/stable/30041857","The Urban Picturesque and the Spectacle of Americanization"
"https://www.jstor.org/stable/30041858","The Trap of Race and Memory: The Language of Spanish Civility on the Upper Rio Grande"
"https://www.jstor.org/stable/30041871","Contesting &quot;The Way the Almighty Wants It&quot;: Crafting Memories of Ex-Slaves in the Slave Narrative Collection"
"https://www.jstor.org/stable/30041872","Nancy Prince and the Politics of Mobility, Home and Diasporic (Mis)Identification"
"https://www.jstor.org/stable/30041873","Victorian Antigone: Classicism and Women's Education in America, 1840-1900"
"https://www.jstor.org/stable/30041886","Prismatics, Multivalence, and Other Riffs on the Millennial Moment Presidential Address to the American Studies Association, 13 October 2000"
"https://www.jstor.org/stable/30041887","&quot;Ah Toucoutou, ye conin vous&quot;: History and Memory in Creole New Orleans"
"https://www.jstor.org/stable/30041888","Signifying Spain, Becoming Comanche, Making Mexicans: Indian Captivity and the History of Chicana/o Popular Performance"
"https://www.jstor.org/stable/30041899","Outrageous Freedom: Charles Mingus and the Invention of the Jazz Workshop"
"https://www.jstor.org/stable/30041900","Fixing the Color Line: The Mulatto, Southern Courts, and Racial Identity"
"https://www.jstor.org/stable/30041901","Coming out against the War: Antimilitarism and the Politicization of Homosexuality in the Era of Vietnam"
"https://www.jstor.org/stable/30041915","Timing Impossible Subjects: The Marketing Style of Booker T. Washington"
"https://www.jstor.org/stable/30041922","Dissertation Abstracts 2000-2001"
"https://www.jstor.org/stable/30041926","&quot;A Whole Synthesis of His Time&quot;: Political Ideology and Cultural Politics in the Writings of William Carlos Williams, 1929-1939"
"https://www.jstor.org/stable/30041927","Into the Madhouse with Nellie Bly: Girl Stunt Reporting in Late Nineteenth-Century America"
"https://www.jstor.org/stable/30041928","Teaching &quot;American Identities&quot;: A University/Secondary School Collaboration"
"https://www.jstor.org/stable/30041941","American Studies in an Age of Globalization"
"https://www.jstor.org/stable/30041942","Dangerous Liaisons: Politics and Epistemology in Post-Cold War American Studies"
"https://www.jstor.org/stable/30041943","More Is Better: Mass Consumption, Gender, and Class Identity in Postwar America"
"https://www.jstor.org/stable/30041944","Respectability and Representation: The Moorish Science Temple, Morocco, and Black Public Culture in 1920s Chicago"
"https://www.jstor.org/stable/30041951","Dissertation Abstracts: 2001-2002"
"https://www.jstor.org/stable/30041955","Conversing with Ourselves: Canon, Freedom, Jazz"
"https://www.jstor.org/stable/30041956","&quot;Our Jerusalem&quot;: Americans in the Holy Land and Protestant Narratives of National Entitlement"
"https://www.jstor.org/stable/30041957","Unnatural Selection: Mothers, Eugenic Feminism, and Charlotte Perkins Gilman's Regeneration Narratives"
"https://www.jstor.org/stable/30041967","Elin Gonzlez and &quot;The Purpose of America&quot;: Nation, Family, and the Child-Citizen"
"https://www.jstor.org/stable/30041968","The Black Jews of Harlem: Representation, Identity, and Race, 1920-1939"
"https://www.jstor.org/stable/30041969","Schizophrenia Americana: Aliens, Alienists, and the &quot;Personality Shift&quot; of Twentieth-Century Culture"
"https://www.jstor.org/stable/30041980","Where in the World Is American Studies? Presidential Address to the American Studies Association, Houston, Texas, November 15, 2002"
"https://www.jstor.org/stable/30041981","To &quot;Corroborate Our Own Claims&quot;: Public Positioning and the Slavery Metaphor in Revolutionary America"
"https://www.jstor.org/stable/30041982","From Spirituals to Swing: Sister Rosetta Tharpe and Gospel Crossover"
"https://www.jstor.org/stable/30041983","&quot;Delicious Horrors&quot;: Mass Culture, the Red Cross, and the Appeal of Modern American Humanitarianism"
"https://www.jstor.org/stable/30041996","Ramona and Postnationalist American Studies: On &quot;Our America&quot; and the Mexican Borderlands"
"https://www.jstor.org/stable/30041997","Domesticating Delphi: Emily Dickinson and the Electro-Magnetic Telegraph"
"https://www.jstor.org/stable/30041998","A Rose by Any Other Name: Charlotte Perkins Stetson (Gilman) and the Case for American Reform Socialism"
"https://www.jstor.org/stable/30041999","Smuggling Sex through the Gates: Race, Sexuality, and the Politics of Space in Second Wave Feminism"
"https://www.jstor.org/stable/30042000","Americans Indians, American Studies and the ASA"
"https://www.jstor.org/stable/30042011","Dissertation Abstracts 2002-2003"
"https://www.jstor.org/stable/30042149","Culture/Wars: Recoding Empire in an Age of Democracy"
"https://www.jstor.org/stable/30042150","Virtual Americas: The Internationalization of American Studies and the Ideology of Exchange"
"https://www.jstor.org/stable/30042151","Nationalist Postnationalism: Globalist Discourse in Contemporary American Culture"
"https://www.jstor.org/stable/30042152","Black Transnationalism and the Politics of National Identity: West Indian Intellectuals in Harlem in the Age of War and Revolution"
"https://www.jstor.org/stable/30042165","China Men, United States v. Wong Kim Ark, and the Question of Citizenship"
"https://www.jstor.org/stable/30042166","Someone's in the Garden with Eve: Race, Religion, and the American Fall"
"https://www.jstor.org/stable/30042167","Fashioning Political Identities: Cultural Studies and the Historical Contruction of Political Subjects"
"https://www.jstor.org/stable/30042168","Linking the Secondary Schools and the University: American Studies as a Collaborative Public Enterprise"
"https://www.jstor.org/stable/30042177","Dissertation Abstracts: 1997-1998"
"https://www.jstor.org/stable/30042181","&quot;The Foundation of All Future Researches&quot;: Franz Boas, George Hunt, Native American Texts, and the Construction of Modernity"
"https://www.jstor.org/stable/30042182","Negotiated Space: The Black College Campus as a Cultural Record of Postbellum America"
"https://www.jstor.org/stable/30042183","African American Art and Critical Discourse between World Wars"
"https://www.jstor.org/stable/30042184","One Black Allah: The Middle East in the Cultural Politics of African American Liberation, 1955-1970"
"https://www.jstor.org/stable/30042198","Apostles of Abstinence: Fasting and Masculinity during the Progressive Era"
"https://www.jstor.org/stable/30042199","Not &quot;Anyone's Daughter&quot;: Patty Hearst and the Postmodern Legal Subject"
"https://www.jstor.org/stable/30042200","Blasphemy and the Law of Religious Liberty in Nineteenth-Century America"
"https://www.jstor.org/stable/30042210","Dissertation Abstracts 1999-2000"
"https://www.jstor.org/stable/30042214","Working at the Crossroads: American Studies for the 21st Century: Presidential Address to the American Studies Association, November 9, 2001"
"https://www.jstor.org/stable/30042215","Sounds of Whiteness: Local Radio, Racial Formation, and Public Culture in Chicago, 1921-1935"
"https://www.jstor.org/stable/30042216","Class, Multiculturalism and the American Quarterly"
"https://www.jstor.org/stable/30042226","&quot;Rosebloom and Pure White,&quot; or so It Seemed"
"https://www.jstor.org/stable/30042227","When Strangers Bring Cameras: The Poetics and Politics of Othered Places"
"https://www.jstor.org/stable/30042228","Wyoming as America: Celebrations, a Museum, and Yale"
"https://www.jstor.org/stable/30042230","Conceptualizing the Real: Environmental History and American Studies"
"https://www.jstor.org/stable/3031195","The Jefferson Image, 1829"
"https://www.jstor.org/stable/3031197","Henry George's British Mission"
"https://www.jstor.org/stable/3031198","The Alienation of the Artist: Alfred Stieglitz"
"https://www.jstor.org/stable/3031199","Notes"
"https://www.jstor.org/stable/3031206","Conservatism, Old and New"
"https://www.jstor.org/stable/3031207","Ten-Gallon Hero"
"https://www.jstor.org/stable/3031208","Christian Culture and American Democracy"
"https://www.jstor.org/stable/3031210","The Cyclical Theory of History in Eighteenth Century America"
"https://www.jstor.org/stable/3031221","The End of American Radicalism"
"https://www.jstor.org/stable/3031222","The Political Theory of Charles A. Beard"
"https://www.jstor.org/stable/3031224","The Ragtime Revival: A Critique"
"https://www.jstor.org/stable/3031225","Lloyd Douglas: Loud Voice in the Wilderness"
"https://www.jstor.org/stable/3031227","Listening to Popular Music"
"https://www.jstor.org/stable/3031235","Billy Budd: &quot;The King's Yarn&quot;"
"https://www.jstor.org/stable/3031237","Dreiser and the Graphic Artist"
"https://www.jstor.org/stable/3031240","The Rise of the Fallen Woman"
"https://www.jstor.org/stable/3031248","On What It Is to Be French"
"https://www.jstor.org/stable/3031258","Documentary Technique in Film Fiction"
"https://www.jstor.org/stable/3031259","The American Poet in Relation to Science"
"https://www.jstor.org/stable/3031262","Literature and Orthodoxy in Boston After the Civil War"
"https://www.jstor.org/stable/3031264","Literary History of the United States."
"https://www.jstor.org/stable/3031270","The Italian Experience (American Artists in Italy 1830-1875)"
"https://www.jstor.org/stable/3031299","The Industrial Way of Life"
"https://www.jstor.org/stable/3031304","Hawthorne and Delia Bacon"
"https://www.jstor.org/stable/3031305","A Preliminary Inquiry Into &quot;Group Images&quot;"
"https://www.jstor.org/stable/3031311","Thorstein Veblen: The Metaphysics of the Interned Immigrant"
"https://www.jstor.org/stable/3031313","The Paving Stones of Paris: Psychometry from Poe to Proust"
"https://www.jstor.org/stable/3031315","Hemingway in Russia"
"https://www.jstor.org/stable/3031326","Clarence King: Scientific Pioneer"
"https://www.jstor.org/stable/3031327","Psychological Types and National Character: An Informal Commentary"
"https://www.jstor.org/stable/3031328","Mark Twain's Satire on Republicanism"
"https://www.jstor.org/stable/3031329","Hugo of the Iceman Cometh: Realism and O'Neill"
"https://www.jstor.org/stable/3031337","Beard and the Constitution: The History of an Idea"
"https://www.jstor.org/stable/3031338","Utopia as Dirge"
"https://www.jstor.org/stable/3031340","The Adams-Jefferson Correspondence, 1812-1826"
"https://www.jstor.org/stable/3031355","Southern Historiography and a History of the South"
"https://www.jstor.org/stable/3031367","Platitudes of Piety: Religion and the Popular Modern Novel"
"https://www.jstor.org/stable/3031368","Kenneth Burke: Tradition and the Individual Critic"
"https://www.jstor.org/stable/3031370","Eugene O'Neill as Social Critic"
"https://www.jstor.org/stable/3031383","Big Technology and Neutral Technicians"
"https://www.jstor.org/stable/3031385","Italianism in American Architecture Before 1860"
"https://www.jstor.org/stable/3031386","Handsome Lake and the Great Revival in the West"
"https://www.jstor.org/stable/3031394","Edward Bellamy's Altruistic Man"
"https://www.jstor.org/stable/3031396","Songs, Singers and Society, 1890-1954"
"https://www.jstor.org/stable/3031397","Kindred Spirits: Bryant and Cole"
"https://www.jstor.org/stable/3031414","Man Against Himself: Walter Lippmann's Years of Doubt"
"https://www.jstor.org/stable/3031415","On the Instrumental Origins of Jazz"
"https://www.jstor.org/stable/3031416","Currier and Ives: A Content Analysis"
"https://www.jstor.org/stable/3031418","No Money for the Kingbird: Hemingway's Prizefight Stories"
"https://www.jstor.org/stable/3031447","Modernism in American Literature"
"https://www.jstor.org/stable/3031449","The Deepening Mind: A Half-Century of American Philosophy"
"https://www.jstor.org/stable/3031453","Hollywood as a Universal Church"
"https://www.jstor.org/stable/3031461","The Painting of American History: 1775 to 1900"
"https://www.jstor.org/stable/3031462","Parrington and the Decline of American Liberalism"
"https://www.jstor.org/stable/3031463","Football in America: A Study in Culture Diffusion"
"https://www.jstor.org/stable/3031464","Ambulance Drivers in France and Italy: 1914-1918"
"https://www.jstor.org/stable/40068195","Entertainment Wars: Television Culture after 9/11"
"https://www.jstor.org/stable/40068196","Between &quot;Crockery-Dom&quot; and Barnum: Boston's Chinese Museum, 1845-47"
"https://www.jstor.org/stable/40068197","The Metropolitan Life in Ruins: Architectural and Fictional Speculations in New York, 1909-19"
