"https://www.jstor.org/stable/2711675","Robert Frost's &quot;The Gift Outright&quot;: Wish and Reality in History and Poetry"
"https://www.jstor.org/stable/2711684","Three Stages of American Automobile Consciousness"
"https://www.jstor.org/stable/2711686","John Bascom 1827-1911: Anti-Positivism and Intuitionism in American Sociology"
"https://www.jstor.org/stable/2711687","Colonel Shaw in American Poetry: &quot;For the Union Dead&quot; and its Precursors"
"https://www.jstor.org/stable/2711688","Undoing the City: Frank Lloyd Wright's Planned Communities"
"https://www.jstor.org/stable/2711693","Ethnicity and Religion in Philadelphia Politics, 1924-40"
"https://www.jstor.org/stable/2711694","The American as Anarchist: Social Criticism in the 1960s"
"https://www.jstor.org/stable/2711695","Looking Inward: Edward Bellamy's Spiritual Crisis"
"https://www.jstor.org/stable/2711696","New Pioneering on the Prairies: Nature, Progress and the Individual in the Novels of Sinclair Lewis"
"https://www.jstor.org/stable/2711697","The New Republican Synthesis and the Changing Political Ideas of John Adams"
"https://www.jstor.org/stable/2711698","The G. I. Bill and Higher Education: Success and Surprise"
"https://www.jstor.org/stable/2711861","Articles in American Studies, 1970: [Literature-Sociology]"
"https://www.jstor.org/stable/2711869","The Free Soil Concept of Progress and the Irrepressible Conflict"
"https://www.jstor.org/stable/2711870","The Southern Agrarians and the Tennessee Valley Authority"
"https://www.jstor.org/stable/2711871","Protest Songs: Those on the Top Forty and Those of the Streets"
"https://www.jstor.org/stable/2711872","Alliance and Antipathy: Ignatius Donnelly's Ambivalent Vision in Doctor Huguet"
"https://www.jstor.org/stable/2711873","Puritans at Merry Mount: Variations on a Theme"
"https://www.jstor.org/stable/2711874","Poetry and Painting: A Love Affair of Long Ago"
"https://www.jstor.org/stable/2711875","The National Negro Congress: A Reassessment"
"https://www.jstor.org/stable/2711885","Death and the Puritan Child"
"https://www.jstor.org/stable/2711887","Heaven Our Home: Consolation Literature in the Northern United States, 1830-1880"
"https://www.jstor.org/stable/2711888","Death in Mexican Folk Culture"
"https://www.jstor.org/stable/2711889","The Reversal of Death: Changes in Attitudes Toward Death in Western Societies"
"https://www.jstor.org/stable/2711893","Zangwill's &quot;The Melting Pot&quot;: Ethnic Tensions on Stage"
"https://www.jstor.org/stable/2711894","The Voyage of Life: Thomas Cole and Romantic Disillusionment"
"https://www.jstor.org/stable/2711895","Saving the Family: Middle Class Attraction to Wright's Prairie House, 1901-1909"
"https://www.jstor.org/stable/2711902","The Social Sciences in American Studies: An Integrative Conception"
"https://www.jstor.org/stable/2711903","Quantitative American Studies: The State of the Art"
"https://www.jstor.org/stable/2711905","Film and American Studies: Questions, Activities, Guides"
"https://www.jstor.org/stable/2711906","Above Ground Archaeology"
"https://www.jstor.org/stable/2711907","The Object as Subject: The Role of Museums and Material Culture Collections in American Studies"
"https://www.jstor.org/stable/2711908","American Studies Dissertations 1973-1974"
"https://www.jstor.org/stable/2711912","The Tribe and the Common School: Community Control in Rural Education"
"https://www.jstor.org/stable/2711913","A Symbol of Modernity: Attitudes Toward the Automobile in Southern Cities in the 1920s"
"https://www.jstor.org/stable/2711914","Mark Twain, Phrenology and the &quot;Temperaments&quot;: A Study of Pseudoscientific Influence"
"https://www.jstor.org/stable/2711915","Status, Values and the Education of the Poor: The Trustees of the New York Public School Society, 1805-1853"
"https://www.jstor.org/stable/2711916","Ralph Ellison and the Metaphor of Invisibility in Black Literary Tradition"
"https://www.jstor.org/stable/2711917","What's My Line: Bennett Cerf, Ezra Pound and the American Poet"
"https://www.jstor.org/stable/2711922","The Pluralistic Identity of William James: A Psycho-historical Reading of &quot;The Varieties of Religious Experience&quot;"
"https://www.jstor.org/stable/2711923","The Perils of Naturalism: Some Reflections on Daniel J. Boorstin's Approach to American History"
"https://www.jstor.org/stable/2711924","&quot;Drum Taps&quot; and Battle-Pieces: The Blossom of War"
"https://www.jstor.org/stable/2711925","American Historians and the Idea of National Character: Some Problems and Prospects"
"https://www.jstor.org/stable/2711926","Henry Miller's Democratic Vistas"
"https://www.jstor.org/stable/2711927","Whatever Happened to an American Socialist Party? A Critical Survey of the Spectrum of Interpretations"
"https://www.jstor.org/stable/2711932","Immigrant Social Aspirations and American Education, 1880-1930"
"https://www.jstor.org/stable/2711933","Frances Trollope in the New World: Domestic Manners of the Americans"
"https://www.jstor.org/stable/2711934","The Original Confidence Man"
"https://www.jstor.org/stable/2711936","Styron's Rebel"
"https://www.jstor.org/stable/2711943","Sociology and Social Literature: Work Alienation in the Plays of Arthur Miller"
"https://www.jstor.org/stable/2711945","Selected Writings on American National Character and Related Subjects to 1969"
"https://www.jstor.org/stable/2712061","Articles in American Studies, 1968: [Art & Architecture-Literature]"
"https://www.jstor.org/stable/2712062","Articles in American Studies, 1968: [Mass Culture-Sociology]"
"https://www.jstor.org/stable/2712063","American Studies Dissertations, 1968-69"
"https://www.jstor.org/stable/2712068","Art, Values, Institutions and Culture: An Essay in American Studies Methodology and Relevance"
"https://www.jstor.org/stable/2712069","The Unitarian Movement and the Art of Preaching in 19th Century America"
"https://www.jstor.org/stable/2712070","The Nursery Tales of Horatio Alger"
"https://www.jstor.org/stable/2712071","Thoreau's &quot;Resurrection of Virtue!&quot;"
"https://www.jstor.org/stable/2712072","John Russell Bartlett's Dictionary of Americanisms"
"https://www.jstor.org/stable/2712073","&quot;Mr. Stoddard's Way&quot;: Church and Sacraments in Northampton"
"https://www.jstor.org/stable/2712209","Articles in American Studies, 1969: [Art & Architecture-Language]"
"https://www.jstor.org/stable/2712210","Articles in American Studies, 1969: [Law-Sociology]"
"https://www.jstor.org/stable/2712211","American Studies Dissertations, 1969-70"
"https://www.jstor.org/stable/2712216","American Studies at Amherst"
"https://www.jstor.org/stable/2712217","American Studies at Bowling Green State University"
"https://www.jstor.org/stable/2712218","American Civ. at Raymond: The &quot;Cluster&quot; Academy as Radical Alternative"
"https://www.jstor.org/stable/2712219","American Civilization at Pennsylvania"
"https://www.jstor.org/stable/2712220","Studying America and American Studies at Yale"
"https://www.jstor.org/stable/2712222","American Studies at the George Washington University"
"https://www.jstor.org/stable/2712224","American Studies at Michigan State University"
"https://www.jstor.org/stable/2712226","Accent on Artist and Artisan: The Winterthur Program in Early American Culture"
"https://www.jstor.org/stable/2712230","The Symbol of the Hieroglyphics in the American Renaissance"
"https://www.jstor.org/stable/2712231","The Paradox of &quot;Progressive&quot; Socialism: The Case of Morris Hillquit, 1901-1914"
"https://www.jstor.org/stable/2712232","Literature and the Historian"
"https://www.jstor.org/stable/2712233","Uncle Tom and Archy Moore: The Antislavery Novel as Ideological Symbol"
"https://www.jstor.org/stable/2712234","Red, White and the Army Blue: Empathy and Anger in the American West"
"https://www.jstor.org/stable/2712248","Family and Fertility on the Indiana Frontier, 1820"
"https://www.jstor.org/stable/2712249","Psychology and Evolutionary Naturalism in American Thought, 1890-1940"
"https://www.jstor.org/stable/2712250","The Spiritual: Soul of Black Religion"
"https://www.jstor.org/stable/2712251","Religion and Reform in the Early Republic: The Role of Youth"
"https://www.jstor.org/stable/2712252","The Women of Cooper's Leatherstocking Tales"
"https://www.jstor.org/stable/2712253","The Search for a Usable American Past in the New Deal Era"
"https://www.jstor.org/stable/2712254","The Uses of Despair: The Sources of Creative Energy in George Santayana"
"https://www.jstor.org/stable/2712255","Ludwig Lewisohn: The Making of an Anti-Communist"
"https://www.jstor.org/stable/2712259","Fictions of Merry Mount"
"https://www.jstor.org/stable/2712261","Paradise Deferred: The Image of Heaven in the Work of Emily Dickinson and Elizabeth Stuart Phelps"
"https://www.jstor.org/stable/2712263","Black Stereotypes as Reflected in Popular Culture, 1880-1920"
"https://www.jstor.org/stable/2712276","Mildred Pierce and Women in Film"
"https://www.jstor.org/stable/2712278","Harry Garfield, the Fuel Administration, and the Search for a Cooperative Order During World War I"
"https://www.jstor.org/stable/2712279","Early American Women Artists and the Social Context in Which They Worked"
"https://www.jstor.org/stable/2712280","Artificial Social Relations in Modern America"
"https://www.jstor.org/stable/2712281","The Responsible Center: Man and Nature in Pueblo and Navaho Ritual Songs and Prayers"
"https://www.jstor.org/stable/2712282","Sacred Circles: Native American Art and American Culture"
"https://www.jstor.org/stable/2712287","&quot;History with Lightning&quot;: The Forgotten Film Wilson"
"https://www.jstor.org/stable/2712288","The Four Faces of Temple Drake: Faulkner's &quot;Sanctuary&quot;, 'Requiem for a Nun&quot;, and the Two Film Adaptations"
"https://www.jstor.org/stable/2712289","Malcolm Lowry's Unpublished Filmscript of Tender is the Night"
"https://www.jstor.org/stable/2712290","Constance Rourke in Context: The Uses of Myth"
"https://www.jstor.org/stable/2712295","The &quot;Quest for National Purpose&quot; of 1960"
"https://www.jstor.org/stable/2712296","One G-Man's Family: Popular Entertainment Formulas and J. Edgar Hoover's F.B.I."
"https://www.jstor.org/stable/2712297","The First Foreign Affairs Think Tanks"
"https://www.jstor.org/stable/2712298","Presidential Images, History, and Homage: Memorializing Theodore Roosevelt, 1919-1967"
"https://www.jstor.org/stable/2712299","The Anarchist-Feminist Response to the &quot;Woman Question&quot; in Late Nineteenth-Century America"
"https://www.jstor.org/stable/2712304","The Psychodynamics of Puritan Conversion"
"https://www.jstor.org/stable/2712306","Culture and Capitalism in Pre-Revolutionary America"
"https://www.jstor.org/stable/2712307","The Dove and Serpent: The Clergy in the American Revolution"
"https://www.jstor.org/stable/2712308","J. Hector St. John Crevecoeur: A Monarcho-Anarchist in Revolutionary America"
"https://www.jstor.org/stable/2712312","Melodramas of Beset Manhood: How Theories of American Fiction Exclude Women Authors"
"https://www.jstor.org/stable/2712313","The Utopian Impulse in Popular Literature: Gothic Romances and &quot;Feminist&quot; Protest"
"https://www.jstor.org/stable/2712314","Murder Trials, Murder, and Twenties America"
"https://www.jstor.org/stable/2712315","The Negative Secularism of The Modern Temper: Joseph Wood Krutch"
"https://www.jstor.org/stable/2712320","The Typology of America's Mission"
"https://www.jstor.org/stable/2712321","Lectures at the Pillory: The Early American Execution Sermon"
"https://www.jstor.org/stable/2712322","The Shepherd's Tent: Education and Enthusiasm in the Great Awakening"
"https://www.jstor.org/stable/2712323","Benjamin Franklin and the Way to Virtue"
"https://www.jstor.org/stable/2712324","The Irrelevant Revolution: 1776 and Since"
"https://www.jstor.org/stable/2712329","The Discovery of Children's Play"
"https://www.jstor.org/stable/2712330","Melville's &quot;The 'Gees&quot;: A Forgotten Satire on Scientific Racism"
"https://www.jstor.org/stable/2712331","A Whitman Primer: Solipsism and Identity"
"https://www.jstor.org/stable/2712332","C. Wright Mills and the Politics of Truth: The Power Elite Revisited"
"https://www.jstor.org/stable/2712337","Archaeology and the American Historian: An Interdisciplinary Challenge"
"https://www.jstor.org/stable/2712338","Ethnic Diversity, Cosmopolitanism and the Emergence of the American Liberal Intelligentsia"
"https://www.jstor.org/stable/2712341","Class and Culture in Boston: The Athenaeum, 1807-1860"
"https://www.jstor.org/stable/2712342","The Spiritualist Medium: A Study of Female Professionalism in Victorian America"
"https://www.jstor.org/stable/2712347","Habits of Mind and an American Enlightenment"
"https://www.jstor.org/stable/2712348","The Uniqueness of the American Enlightenment"
"https://www.jstor.org/stable/2712349","The Republican Mother: Women and the Enlightenment-An American Perspective"
"https://www.jstor.org/stable/2712350","Slavery, Race, and Equality: Jefferson and the Pathos of the Enlightenment"
"https://www.jstor.org/stable/2712352","Recycling Early National History Through the Papers of the Founding Fathers"
"https://www.jstor.org/stable/2712353","The Enlightened Reader in America"
"https://www.jstor.org/stable/2712356","Antimasonry and Masonry: The Genesis of Protest, 1826-1827"
"https://www.jstor.org/stable/2712357","American Anti-Semitism: A Reinterpretation"
"https://www.jstor.org/stable/2712358","The March of Time and the World Today"
"https://www.jstor.org/stable/2712359","It Could Happen Here: The Rise of the Political Scenario Novel"
"https://www.jstor.org/stable/2712360","William James-Warts and All"
"https://www.jstor.org/stable/2712399","Saints and Sisters: Congregational and Quaker Women in the Early Colonial Period"
"https://www.jstor.org/stable/2712400","A Women's Awakening: Evangelical Religion and the Families of Utica, New York, 1800-1840"
"https://www.jstor.org/stable/2712403","Organized Voluntarism: The Catholic Sisters in Massachusetts, 1870-1940"
"https://www.jstor.org/stable/2712404","Transitions in Judaism: The Jewish American Woman Through the 1930s"
"https://www.jstor.org/stable/2712405","Minister's Wife, Widow, Reluctant Feminist: Catherine Marshall in the 1950s"
"https://www.jstor.org/stable/2712409","From Doctrine to Narrative: The Rise of Pulpit Storytelling in America"
"https://www.jstor.org/stable/2712410","Cooper and the &quot;Cup and Saucer&quot; Law: A New Reading of The Ways of the Hour"
"https://www.jstor.org/stable/2712411","Another Sleeping Beauty: Narcissism in The House of Mirth"
"https://www.jstor.org/stable/2712412","Irony and Symbolic Action in James Weldon Johnson's The Autobiography of an Ex-Coloured Man"
"https://www.jstor.org/stable/2712417","The Proper Study-Autobiographies in American Studies"
"https://www.jstor.org/stable/2712418","Women Studies/American Studies, 1970-1975"
"https://www.jstor.org/stable/2712419","&quot;Doing the Rest&quot;: The Uses of Photographs in American Studies"
"https://www.jstor.org/stable/2712420","American Studies in Community Colleges"
"https://www.jstor.org/stable/2712421","American Studies Research in Progress, 1976-1977"
"https://www.jstor.org/stable/2712428","The Grapes of Wrath (1940): Thematic Emphasis Through Visual Style"
"https://www.jstor.org/stable/2712429","The Negro Soldier (1944): Film Propanganda in Black and White"
"https://www.jstor.org/stable/2712430","The Snake Pit (1948): The Sexist Nature of Sanity"
"https://www.jstor.org/stable/2712431","Ambivalence as a Theme in &quot;On the Waterfront&quot; (1954): An Interdisciplinary Approach to Film Study"
"https://www.jstor.org/stable/2712432","Dr. Strangelove (1964): Nightmare Comedy and the Ideology of Liberal Consensus"
"https://www.jstor.org/stable/2712434","Film, Television, and American Studies: Questions, Activities, Guides"
"https://www.jstor.org/stable/2712438","American Victorianism as a Culture"
"https://www.jstor.org/stable/2712439","Modernization: A Victorian Climax"
"https://www.jstor.org/stable/2712443","American Intellectuals and the Victorian Crisis of Faith"
"https://www.jstor.org/stable/2712444","The Assault on Victorianism in the Twentieth Century"
"https://www.jstor.org/stable/2712451","Beyond Visual Aids: American Film as American Culture"
"https://www.jstor.org/stable/2712452","Radio and Television Studies and American Culture"
"https://www.jstor.org/stable/2712458","The New England Kitchen and the Origins of Modern American Eating Habits"
"https://www.jstor.org/stable/2712460","&quot;After College, What?&quot;: New Graduates and the Family Claim"
"https://www.jstor.org/stable/2712474","American Air Strategy in China, 1939-1941: The Origins of Clandestine Air Warfare"
"https://www.jstor.org/stable/2712475","Vertuous Women Found: New England Ministerial Literature, 1668-1735"
"https://www.jstor.org/stable/2712476","The Navy Before Darwinism: Science, Exploration, and Diplomacy in Antebellum America"
"https://www.jstor.org/stable/2712477","Uncle Tom Reconstructed: A Neglected Chapter in the History of a Book"
"https://www.jstor.org/stable/2712478","Immoral Fiction in the Late Victorian Library"
"https://www.jstor.org/stable/2712486","Proslavery Millennialism: Social Eschatology in Antebellum Southern Calvinism"
"https://www.jstor.org/stable/2712487","A Southern Stewardship: The Intellectual and the Proslavery Argument"
"https://www.jstor.org/stable/2712488","Confidence and Pertinacity in Evangelical Abolitionism: Lewis Tappan's Circle"
"https://www.jstor.org/stable/2712494","Images of the Millerites in American Literature"
"https://www.jstor.org/stable/2712495","Organizing for Reform: The Anti-Saloon League and Innovation in Politics"
"https://www.jstor.org/stable/2712496","&quot;Since They Got Those Separate Churches&quot;: Afro-Americans and Racism in Jacksonian Philadelphia"
"https://www.jstor.org/stable/2712497","Holy Time and Sacred Space in Puritan New England"
"https://www.jstor.org/stable/2712502","Structuralism, American Studies, and the Humanities"
"https://www.jstor.org/stable/2712503","Structuralism in History and the Social Sciences"
"https://www.jstor.org/stable/2712504","American Drama, 1918-1940: A Survey of Research and Criticism"
"https://www.jstor.org/stable/2712505","Drama as Cultural Sign: American Dramatic Criticism, 1945-1978"
"https://www.jstor.org/stable/2712506","Afro-American Theatre: A Bibliographic Survey"
"https://www.jstor.org/stable/2712507","Bibliographies in Afro-American Art"
"https://www.jstor.org/stable/2712508","Afro-American Fiction: Contemporary Research and Criticism, 1965-1978"
"https://www.jstor.org/stable/2712509","The Voluntary American Studies Program: Strategies for Development"
"https://www.jstor.org/stable/2712515","Psychoanalysis and American Literary Culture"
"https://www.jstor.org/stable/2712516","The Uses and Abuses of Psychology in American History"
"https://www.jstor.org/stable/2712517","The Sociological Endeavor and Psychoanalytic Thought"
"https://www.jstor.org/stable/2712518","American Folklore and American Studies"
"https://www.jstor.org/stable/2712520","American Studies Research in Progress 1975-1976"
"https://www.jstor.org/stable/2712524","A Theory of Genre: Romance, Realism, and Moral Reality"
"https://www.jstor.org/stable/2712525","Scarlett O'Hara: The Southern Lady as New Woman"
"https://www.jstor.org/stable/2712526","Sexual Warfare in the Silent Cinema: Comedies and Melodramas of Woman Suffragism"
"https://www.jstor.org/stable/2712527","George Wilkes: The Transformation of a Radical Ideology"
"https://www.jstor.org/stable/2712534","Fertility, Class, and Industrial Capitalism: Erie County, New York, 1855-1915"
"https://www.jstor.org/stable/2712538","Words as Social Control: Noah Webster and the Creation of the American Dictionary"
"https://www.jstor.org/stable/2712539","Women and Indians: The Last of the Mohicans and the Captivity Tradition"
"https://www.jstor.org/stable/2712540","In Search of &quot;The Spirit of '76&quot;"
"https://www.jstor.org/stable/2712542","Intellect on Television: The Quiz Show Scandals of the 1950s"
"https://www.jstor.org/stable/2712559","The Gnosis of Hawthorne and Melville: An Interpretation of the Scarlet Letter and Moby-Dick"
"https://www.jstor.org/stable/2712560","&quot;Bright American Rivers&quot;: The Luminist Landscapes of Thoreau's A Week on the Concord and Merrimack Rivers"
"https://www.jstor.org/stable/2712561","Kindred Spirits: Martin Johnson Heade, Painter; Frederick Goddard Tuckerman, Poet; and the Identification with &quot;Desert&quot; Places"
"https://www.jstor.org/stable/2712562","&quot;Frederic Henry Hedge, What Say You?&quot;"
"https://www.jstor.org/stable/2712563","Liberation from Man and God in Boston: Abner Kneeland's Free-Thought Campaign, 1830-1839"
"https://www.jstor.org/stable/2712568","Science and Anarchy: Walter Lippmann's Drift and Mastery"
"https://www.jstor.org/stable/2712570","Studs Lonigan and the Failure of History in Mass Society: A Study in Claustrophobia"
"https://www.jstor.org/stable/2712571","How to Win Friends and Influence People: Dale Carnegie and the Problem of Sincerity"
"https://www.jstor.org/stable/2712573","A Retrospective Look at the Catcher in the Rye"
"https://www.jstor.org/stable/2712574","The Scientist as Sex Crusader: Alfred C. Kinsey and American Culture"
"https://www.jstor.org/stable/2712591","The Early Republic's Supernatural Economy: Treasure Seeking in the American Northeast, 1780-1830"
"https://www.jstor.org/stable/2712592","Three Mile Island: Fact, Frame, and Fiction"
"https://www.jstor.org/stable/2712593","The Transportation Revolution and Antebellum Book Distribution Reconsidered"
"https://www.jstor.org/stable/2712594","&quot;The Affairs of the Revolution Occasion'd the Interruption&quot;: Writing, Revolution, Deferral, and Conciliation in Franklin's Autobiography"
"https://www.jstor.org/stable/2712595","Francis Parkman and the Male Tradition"
"https://www.jstor.org/stable/2712606","Mutations of the Supernatural: Witchcraft, Remarkable Providences, and the Power of Puritan Men"
"https://www.jstor.org/stable/2712607","Revivalism and Nativism in the Middle Colonies: The Great Awakening and the Scots Community in East New Jersey"
"https://www.jstor.org/stable/2712608","The Political Odyssey of William Henry Channing"
"https://www.jstor.org/stable/2712609","&quot;Making Night Hideous&quot;: Christmas Revelry and Public Order in Nineteenth-Century Philadelphia"
"https://www.jstor.org/stable/2712614","The Design of Public Housing in the New Deal: Oskar Stonorov and the Carl Mackley Houses"
"https://www.jstor.org/stable/2712615","The American Eve: Miscegenation and a Feminist Frontier Fiction"
"https://www.jstor.org/stable/2712616","An &quot;Army of Amazons&quot;: The Language of Protest in a Kansas Mining Community, 1921-22"
"https://www.jstor.org/stable/2712617","Albert Hensley's Two Autobiographies and the History of American Indian Autobiography"
"https://www.jstor.org/stable/2712618","&quot;The General Motherhood of the Commonwealth&quot;: Dance Hall Reform in the Progressive Era"
"https://www.jstor.org/stable/2712627","Towards a Definition of American Modernism"
"https://www.jstor.org/stable/2712628","The Nonhomemade World: European and American Modernism"
"https://www.jstor.org/stable/2712629","The Knower and the Artificer"
"https://www.jstor.org/stable/2712630","What Have Modernists Looked At? Experiential Roots of Twentieth-Century American Painting"
"https://www.jstor.org/stable/2712631","Modernism and the Harlem Renaissance"
"https://www.jstor.org/stable/2712632","Getting Spliced: Modernism and Sexual Difference"
"https://www.jstor.org/stable/2712633","Modernism Mummified"
"https://www.jstor.org/stable/2712634","Uneasy Courtship: Modern Art and Modern Advertising"
"https://www.jstor.org/stable/2712635","Modern Art and the Invention of Postmodern Capital"
"https://www.jstor.org/stable/2712640","Feminism, Professionalism, and Germs: The Thought of Mary Putnam Jacobi and Elizabeth Blackwell"
"https://www.jstor.org/stable/2712641","Unregenerate Doings: Selflessness and Selfishness in New Divinity Theology"
"https://www.jstor.org/stable/2712642","&quot;The Quagmires of Necessity&quot;: American Anarchists and Dilemmas of Vocation"
"https://www.jstor.org/stable/2712643","Secular Transcendence: The American Religious Humanists"
"https://www.jstor.org/stable/2712644","Freemasonry and Community in the Early Republic: The Case for Antimasonic Anxieties"
"https://www.jstor.org/stable/2712650","Learning from Looking: Geographic and Other Writing about the American Cultural Landscape"
"https://www.jstor.org/stable/2712651","The Power of Things: Recent Studies in American Vernacular Architecture"
"https://www.jstor.org/stable/2712652","American Decorative Arts/Household Furnishings"
"https://www.jstor.org/stable/2712654","&quot;Visible Proofs&quot;: Material Culture Study in American Folkloristics"
"https://www.jstor.org/stable/2712660","The City as Social System: The Importance of Ideas"
"https://www.jstor.org/stable/2712661","New Life for an Old Subject: Investigating the Structure of Urban Rule"
"https://www.jstor.org/stable/2712663","Re-Reading Suburban America: Urban Population Deconcentration, 1810-1980"
"https://www.jstor.org/stable/2712664","Sorting Out the Suburbs: Patterns of Land Use, Class, and Culture"
"https://www.jstor.org/stable/2712665","Frontiers and Sections: Cities and Regions in American Growth"
"https://www.jstor.org/stable/2712666","Doing Local History: Monographic Approaches to the Smaller Community"
"https://www.jstor.org/stable/2712667","Creating the American Athens: Cities, Cultural Institutions, and the Arts, 1840-1930"
"https://www.jstor.org/stable/2712668","American Studies Research in Progress, 1985-86"
"https://www.jstor.org/stable/2712672","&quot;The Special American Conditions&quot;: Marxism and American Studies"
