"http://www.theasa.net/","When Devastation Isn’t Enough: Threats to Indigenous Sustainability, Climate Colonialism and Environmental In/Justices."
"http://www.theasa.net/","Race and Architecture in the Pattern Book Era"
"http://www.theasa.net/","Racial Re-remembering in Landscape: The Implications of the New Catherine Foster Memorial Park on the Grounds of Mr. Jefferson’s University"
"http://www.theasa.net/","Utopia and Romance in the Marchlands: Exquemelin’s Buccaneers, de Lussan’s Journal and the Limits of Narrative"
"http://www.theasa.net/","Literary Studies, Violence, and Neoliberal Racialism"
"http://www.theasa.net/","Empathy in Praxis: The Feelings at Work in Victims' Mothers' Testimonios"
"http://www.theasa.net/","New Media Nonesuch: : The Persistence of American Exceptionalism in the Embrace of New Media"
"http://www.theasa.net/","New Trends in Christian Material Culture: The American Pro-Life and Pregnancy Loss Support Movements"
"http://www.theasa.net/","Becoming Indo-Hispano: Land-Grant Activists Confront the Legacies of Conquest in 1960s New Mexico"
"http://www.theasa.net/","That “Monster House” is My Home: Race, Immigration, and the Politics of Suburban Development"
"http://www.theasa.net/","Imagining State and Federal Law in Pauline Hopkins’s Contending Forces"
"http://www.theasa.net/","Peer-to-Peer Lending: Can Social Networks Redeem Credit Markets?"
"http://www.theasa.net/","Racial Order and Reorder: Tracing Genealogies of the ‘Post-Racial’"
"http://www.theasa.net/","A Model of Respectability: Black Women’s Periodicals and the Mental Hygiene Movement"
"http://www.theasa.net/","Race and Affect in Richard Wright’s Savage Holiday"
"http://www.theasa.net/","On the Ethics of Impersonal Narcissism: James Baldwin and Leo Bersani"
"http://www.theasa.net/","Re-Imagining America: Jeff Smith, Herman Melville, and National Dreamscapes"
"http://www.theasa.net/","Campaigning for Obama in California, Texas, and Beyond: The Politics of Race and Gender Relationality in the Post-911 Era"
"http://www.theasa.net/","Deception in Early American Art and Politics"
"http://www.theasa.net/","Birthright Battles: Historicizing Efforts to Eliminate the 14th Amendment"
"http://www.theasa.net/","Selling America to Asians: The America Today Magazine and Cultural Diplomacy in the Cold War"
"http://www.theasa.net/","Raza Rockabilly: Reclaimed Space, History, and Identity in Contemporary Los Angeles"
"http://www.theasa.net/","A Japanese Twain and an American Dime Novelist: Kuni Sasaki’s Adaptations of Metta Victor’s Novels"
"http://www.theasa.net/","Fred Wilson and the Rhetoric of Redress"
"http://www.theasa.net/","A Conversation with Fred Wilson, conducted by Lisa G. Corrin"
"http://www.theasa.net/","Sensitive Citizenship, Passing, and Other Nervous Conditions"
"http://www.theasa.net/","Nothing Is True; Everything Is Permitted: The War on Terror’s Factual Fictions"
"http://www.theasa.net/","Horror in Appalachia, or, What Happens When Suburban Whites Take a 'Wrong Turn'"
"http://www.theasa.net/","'Why Negro Girls Stay Single:' Gender, Sexuality, and the Left in Pauli Murray's Shifting Politics"
"http://www.theasa.net/","Camp Unity: Camp and Popular Front Aesthetics and Reception"
"http://www.theasa.net/","Imagining Reparations for African American Slavery: Albion W. Tourgée’s Pactolus Prime"
"http://www.theasa.net/","Re-imagining Peace and Repatriation, from “Palestine” to “America”"
"http://www.theasa.net/","Marching Black and Gay for MLK: Black LGBTQI Movement Building in Los Angeles"
"http://www.theasa.net/","'America—Disguising Hypocrisy as Democracy': Immigration and National Belonging in Contemporary Black Performance Poetry"
"http://www.theasa.net/","Obama Street Art: Civic Icons, Collective Memory and the Visual Politics of National Identity"
"http://www.theasa.net/","A Community of Internet Performers: Miranda July’s and Harrell Fletcher’s Learning to Love You More"
"http://www.theasa.net/","Making Wildlife Traffic: The Emergence of an Illicit Commodity in Early Twentieth-Century America"
"http://www.theasa.net/","The American University in the World: Academic Freedom and the Middle East"
"http://www.theasa.net/","Emmett Till’s Disappearance in the White Press"
"http://www.theasa.net/","On the Intransigence of Transit: Marian Anderson’s Performance in News Pictures"
"http://www.theasa.net/","European Others: Queering Ethnicity in Postnational Europe"
"http://www.theasa.net/","Cesar Chavez and the Dilemma of Black Power"
"http://www.theasa.net/","'A Common Citizenship of Freedom': What Black Power Taught Chicago’s Puerto Rican Independentistas"
"http://www.theasa.net/","From 'Paper Integration' to Community Control: Developing Black and Puerto Rican Political Independence in Schools, 1966-73"
"http://www.theasa.net/","Hornbook, Picture Book, Comic Book, Facebook: Historical Perspectives on New Media and Childhood"
"http://www.theasa.net/","Beyond Scripture: Book Groups and Religious Reading Practices"
"http://www.theasa.net/","Of Golden Eagles and Sarcophagi: The Spectacularized Terrain of a Carnival Cruise Ship"
"http://www.theasa.net/","Hoarding Knowledge: Excess and the Ethel Index"
"http://www.theasa.net/","Biopolitics, Animal Studies, and the Liberal Subject"
"http://www.theasa.net/","Of Cannibals and Snuff Films: Bare Life, Bioethics and Brazilian Anthropofagia"
"http://www.theasa.net/","'Tu Voz TV': Mexican Migrants, Self-Representation and Documentary Video"
"http://www.theasa.net/","Narratives of Dispossession: West Baltimore, Agency, and the Neoliberal City"
"http://www.theasa.net/","Beyond the 'Post-Civil Rights': White Reconstruction and the Prison Regime"
"http://www.theasa.net/","Well Nye Over: The Strange Career of an American Studies Program"
"http://www.theasa.net/","Hard Times in the Land of Plenty: Imagining American Studies at the Land-Grant University"
"http://www.theasa.net/","Passing for Cuban/American: Expatriate Cubanismo in Achy Obejas’ Ruins"
"http://www.theasa.net/","Censoring and Sanitizing War Trauma: Psychiatrists, the Military, and Public Opinion during World War II"
"http://www.theasa.net/","Foucault and the Bag Lady: The Backlash against Anti-Psychiatry"
"http://www.theasa.net/","Ceaselessly Restless Savages: Cannibalism and Empire in the Slavic Immigrant Press"
"http://www.theasa.net/","New York City’s 'Lonely Crimes' Narrative in the Sixties and Seventies"
"http://www.theasa.net/","Capturing a City, Claiming Belonging: Issei Photographers in Seattle, Washington, 1924-1929"
"http://www.theasa.net/","Desiring National Bodies: Historical Imagination and the Neoliberal Erotic in Axis Powers Hetalia"
"http://www.theasa.net/","Framed and Shamed Bodies: Looking at Photographs of Lynchings"
"http://www.theasa.net/","The Affective Labor of War: Gendered Counterinsurgency and U.S. Female Engagement Teams"
"http://www.theasa.net/","A Mother’s Love: Gold Star Mothers and the Sacrifices of Citizenship"
"http://www.theasa.net/","Fossil Fuels and Sandstorms from the Grassland: Historical Imagination, Environmental Transformation, and Cultural Reparation"
"http://www.theasa.net/","Sewage Farming, Sludge Composting, and Recycling Rhetorics: Historical and Contemporary Cosmologies of Nature"
"http://www.theasa.net/","A Eurasian Disciple of the Harlem Renaissance: The Life and Work of Cedric Dover (1904-1961)"
"http://www.theasa.net/","Healing the Diaspora Consciousness:Homecoming of the Chinese Legendary Hero Fa Mu Lan in America"
"http://www.theasa.net/","Making Love: Commercialized Sex and the Construction of Idealized Love"
"http://www.theasa.net/","Ralph Waldo Emerson, Alan Greenspan, and Panic Rhetoric in America"
"http://www.theasa.net/","Imagining an Abrahamic America: Muslim Moderation and the Transformation of Histories"
"http://www.theasa.net/","Vital Bodies and Vital Consciousness in Samuel Delany"
"http://www.theasa.net/","The Biopolitics of Transformation: Lycanthropy and Thresholds of Indistinction in Charles Brockden Brown's Edgar Huntly"
"http://www.theasa.net/","Zombie Biopolitics: Colonial Geography, Race, and the Spectacle of Torture"
"http://www.theasa.net/","'Hold Still': Redeemed Children, Unstable Geographies, and the Meantime"
"http://www.theasa.net/","'Aw, aw! Ah’m colored!': Writing Blackness, Writing Childhood"
"http://www.theasa.net/","The Art of American Aquaculture: Thomas Eakins in New Jersey"
"http://www.theasa.net/","Re-Greening Bronzeville: Recovering African American Environmental Imagination during the Great Migration"
"http://www.theasa.net/","Imagining Rural Sexuality in the Depression Era: Child Brides, Exploitation Film, and the Winstead-Johns Marriage"
"http://www.theasa.net/","Re-Evaulating the Pequot War"
"http://www.theasa.net/","Eulogy of the Pequot War"
"http://www.theasa.net/","Neoliberal Temporality: Time-Sense and the Shift from Pensions to 401(k)s"
"http://www.theasa.net/","Digital Display Technologies in Mainline Media Ministries"
"http://www.theasa.net/","Uneasy Duets: Contemporary American Dances about Israel and the Mideast Crisis"
"http://www.theasa.net/","Visual Occupations: Security Regimes and the Art of Seeing"
"http://www.theasa.net/","Handed Down from Our Mothers: Sex, Law and Motherhood in Eighteenth-Century Maine"
"http://www.theasa.net/","Making It Do, or Doing Without? : Representing the Migrant Mother during the Great Depression"
"http://www.theasa.net/","Managing Democracy: Technocratic Aid, Governance, and the Philippine State"
"http://www.theasa.net/","George Washington Williams, King Leopold II, and African American Emigration to the Congo"
"http://www.theasa.net/","Queerness in the Wilderness: Rural Lives of Female-Bodied Men at the Turn of the Twentieth Century"
"http://www.theasa.net/","Victory Culture and the U.S. Wars on the Environment: 1945-1962"
"http://www.theasa.net/","Ecologies of War: Dispatch from the Aerial Empire"
"http://www.theasa.net/","Radiation Laboratories and Ecosystem Ecologies in the Nuclear Pacific"
"http://www.theasa.net/","Filipino Nationalism and Tutelary Colonialism: Camilo Osias’s Readers and Post-colonial Modernity"
"http://www.theasa.net/","Waging Wars and Founding Universities: American Empire and Its Higher Educational Mission after 1898"
"http://www.theasa.net/","Epidemiology and Early American Studies"
"http://www.theasa.net/","Ugly Feelings: Affect, Canonicity, and American Literature 1800-1820"
"http://www.theasa.net/","Narrative Practice: Writing between the Lines"
"http://www.theasa.net/","Making Price Mean Less: Books, Value and the National Industrial Recovery Administration"
"http://www.theasa.net/","Participatory Art as Political Repair: “Education and Democracy” by Group Material"
"http://www.theasa.net/","War, Empire, Vaccines, and Nanotechnology: Representations of Gender in Post-9/11 Discourses of Scientific Nationalism"
"http://www.theasa.net/","Queering the First Citizen: Dishonorable Discharges and Legacies of Imperialism in James Barr’s Quatrefoil"
"http://www.theasa.net/","Listening in the Cold War Years"
"http://www.theasa.net/","Madam Zajj and U.S. Steel: Duke Ellington's Calypso Theatre"
"http://www.theasa.net/","Hamlin Garland: Mass-Mediated Son of the Middle Border"
"http://www.theasa.net/","Lewis Mumford, Freeway Flier: Midcentury Planning as Regional Humanism"
"http://www.theasa.net/","Developing the Historical Sense: The Material Culture of the Historical Imagination, 1880-1920"
"http://www.theasa.net/","Raggedy Ann and the Racial Scripts of Book-Doll Combinations"
"http://www.theasa.net/","A Genealogy of Queer Anti-Imperialism"
"http://www.theasa.net/","'Real Democracy at Work': Multiracialism and Supplanted Narratives of Dominance in Post-WWII Hawaii"
"http://www.theasa.net/","Behind Closed Doors: The (Im)possibility of the African Diasporic Home"
"http://www.theasa.net/","We Shall Not Be 'Dipt in Blood': The Quaker Peace Testimony in Pennsylvania and Colonial Violence on the Cultural Margins of Empire, 1680-1720s"
"http://www.theasa.net/","Imagining War and Peace: Martial and Pacifist Iconography in Colonial Pennsylvania"
"http://www.theasa.net/","Imaginative Routes: Communication/Visual Technologies and Latin/a American Transnational Motherhood in Almudena Carracedo’s 'Made in L.A.'"
"http://www.theasa.net/","What Is a Digital Sound Object?"
"http://www.theasa.net/","The Autonomous Eye: Cybernetics, Perception, and Bio-politics"
"http://www.theasa.net/","Quaintifying ‘Her Wavering Image’: Sui Sin Far and the Publishing Industry"
"http://www.theasa.net/","War Haunts: Imperial Memory and Ghost Tourism Aboard the USS Hornet Museum"
"http://www.theasa.net/","Empire Expressed: Literary Form in the Covert Capital"
"http://www.theasa.net/","Way Out West: Marketing Gay Male Culture in California Bar Ads, 1963-77"
"http://www.theasa.net/","Joseph F. Smith and “Black Jane”: Challenges to the Formalization of Mormon Racial Identity (1908)"
"http://www.theasa.net/","Zion’s Nature: The Religious Imagination and Ecological Transformation in Mormon Literature"
"http://www.theasa.net/","A Bond of Solemn Obligation: Thomas Paine and the Fragility of Community"
"http://www.theasa.net/","Legends of Unity: Identity, Sports, Romanticism"
"http://www.theasa.net/","Gendered Knowledges & the Conservation of Biocultural Diversity: Resisting World Bank Supranational Projects"
"http://www.theasa.net/","Feminist 'Sorority' against Feminicide: Natural Resources, Militarization, and the 'Project Mesoamerica' (Plan Puebla-Panamá)"
"http://www.theasa.net/","University of Radicalism: Leavenworth Penitentiary and the Magón Brothers"
"http://www.theasa.net/","Visible Queers, Disappearing Nation: Transgender Filipino Domestic Workers and the Return of the (Silent) Nation"
"http://www.theasa.net/","Settling Desire: (Post-)AIDS Visuality, Masculine Properties, and the Desire of Geopolitics"
"http://www.theasa.net/","Manufacturing Democracy: Israeli Pinkwashing in the United States and the Propaganda of Public Relations"
"http://www.theasa.net/","Dean of Invention: High-Tech Normalcy and Disabled Devices"
"http://www.theasa.net/","Defending Indigenous Territorial Rights and the Struggle of Resources in the Lacandon Jungle"
"http://www.theasa.net/","Territory: Indigenous and Western Juridical Concepts before the Resolutions of the OAS's Inter-American Court of Human Rights"
"http://www.theasa.net/","En-gendering Justice? Expert Knowledge and Women’s Prison Reform"
"http://www.theasa.net/","Yakama Women Elders Discuss Indigeneity & the Tensions of Teaching Indigenous Language and Cultural Practices"
"http://www.theasa.net/","Deliver Us from Evil: The Role of Religious Institutions in Reparation and Transformation of Post-Genocidal Societies"
"http://www.theasa.net/","Error of Commission: The Roman Catholic Church and the Rwandan Genocide"
"http://www.theasa.net/","The Armenian Genocide Memorial: The Role of Religion in the Reparation and Transformation of a Community"
"http://www.theasa.net/","Eichmann in America: The 'Uncivil' Imagination as a Challenge to Empire's Evil"
"http://www.theasa.net/","Justice Will Be Done Either Here or From Above: God's Intervention in Puerto Rican Sexual Citizenship"
"http://www.theasa.net/","God Loves Them as They Are: How Religion Helped Pass Gay Rights in Wisconsin in 1982"
"http://www.theasa.net/","Sex Scandals among Religious Leaders: Healing the Breach"
"http://www.theasa.net/","Literary Black Power in the Caribbean"
"http://www.theasa.net/","Little Lindy Is Kidnapped: The Crime of the Twentieth Century"
"http://www.theasa.net/","Caryn Campbell: A Case Study"
"http://www.theasa.net/","Decolonization, Cultural Citizenship, and Black Liberation in Trinidad"
"http://www.theasa.net/","Neo-Slave Narratives Out of Canada"
"http://www.theasa.net/","El Museo del Norte: Local Memory and Transformation in Latina/o Detroit"
"http://www.theasa.net/","Re-inventing Authenticity: Big Brother and the Holding Company’s Cheap Thrills as Haight-Ashbury Counterculture Statement"
"http://www.theasa.net/","James Weldon Johnson’s Soundscape of Modernity: Black Manhattan"
"http://www.theasa.net/","Narrative Acoustics: ‘Free’ Writing Black Consciousness"
"http://www.theasa.net/","Jayne Cortez, Post-Dialect Poetry, and Lyric Mainstream"
"http://www.theasa.net/","Panoramas of the Future: War, Industry, and American Moving Panoramas, 1840-1865"
"http://www.theasa.net/","George Lippard and the Literature of Esoteric Socialism"
"http://www.theasa.net/","Narrative Technologies: Representing Digital Labor on American Television"
"http://www.theasa.net/","Imagine That: Settler-Colonialism, Native Women, and Urban Indian Identity"
"http://www.theasa.net/","What’s in a Map?: Reimagining Social Worlds Under Segregation in Los Angeles"
"http://www.theasa.net/","Listening to Change: Radio, Humor, and the Future of Cuban Miami"
"http://www.theasa.net/","Beyond a Cutout World: Ethnic Humor and Discursive Integration in South Park"
"http://www.theasa.net/","Gaming the Cold War: The Call of Duty Video Game Franchise and the Crisis of Historical Knowledge"
"http://www.theasa.net/","YouTube (Pre)Occupation: New Media and the Israeli Military Occupation"
"http://www.theasa.net/","Kiva Culture: Christian Evangelicals and Online Humanitarianism"
"http://www.theasa.net/","Imagination and Transformation in Alarm Will Sound’s 1969"
"http://www.theasa.net/","Manifold Music: On Markets and the Limits of Racial Exchange"
"http://www.theasa.net/","Capitalist Aesthetics: Americans Look at the London and Liverpool Docks"
"http://www.theasa.net/","'The Stands Bereft of People': The Labor and Politics of World Cup Stadia"
"http://www.theasa.net/","On Skid Row: Bowery Bums and the Politics of Waste"
"http://www.theasa.net/","Paternal Solicitude and Haitian Emigration: The First American Occupation"
"http://www.theasa.net/","Designed to Fit (In): Virtual Fitting Rooms and the Cultural Construction of Biorobotics"
"http://www.theasa.net/","Imagining Elena: A Performance of Clinical Interpretation"
"http://www.theasa.net/","Historical Imagination and the Borders of Intimacy: Asian American Voters in the Prop 8 Debate"
"http://www.theasa.net/","Imagining Neoliberal Brotherhoods: Jeffrey Sachs, Gonzalo Sanchez de Lozada, and Indigenous Resistance in Bolivia"
"http://www.theasa.net/","Central America and the New Geographies of Empire"
"http://www.theasa.net/","French Africans in Ojibwe Country: 19th Century Fur Traders Negotiating Fluctuations and Transformations of Identity"
"http://www.theasa.net/","Henry Darger’s Artistic Repurposing of the “Waste Products of Humanity”"
"http://www.theasa.net/","Being Good Isn’t Always Easy: Aretha Franklin, Dusty Springfield and Janis Joplin in the 1960s"
"http://www.theasa.net/","Nuyorican Women Artists Remember Julia de Burgos"
"http://www.theasa.net/","SAYcred LAYdy Revisited: Lorraine Sutton and Nuyorican Poetics"
"http://www.theasa.net/","Penetrating Secularism: Lived Experiences and Cultural Practices of American Christian Auto-modifiers"
"http://www.theasa.net/","Gayness as Property: White Gay Activism and the Delinking of Sexual and Urban Disorder in Washington, D.C. 1975-1985"
"http://www.theasa.net/","Urban Blight as Opportunity: Appropriation and Transformation in Pittsburgh’s Hill District"
"http://www.theasa.net/","Feeling Biomedicalization: Affect in 'The DNA Age'"
"http://www.theasa.net/","Mapping the Debates over Abortion Coverage in Health Care Reform: An Intersectional Approach to Critical Discourse Analysis"
"http://www.theasa.net/","Mankind, Manhood, and the Protest Fiction Debate"
"http://www.theasa.net/","Kinship and the Unsensed Sensation of the Novel"
"http://www.theasa.net/","A Colorful Aesthetics of Poverty: “Culture of Poverty” Writing, Colorful Digressions, and a Sociological Understanding of Latina/os"
"http://www.theasa.net/","Jovita Gonzalez and the Dilemma over Mexicanness"
"http://www.theasa.net/","What Women Want (To Do): Wedding Planning and the ‘Postindustrial’ Economy"
"http://www.theasa.net/","Passing Down the Aisle: Gay Marriage through Subterfuge in the 1970s"
"http://www.theasa.net/","Depicting Distant Suffering: The Politics of Images & Evangelical Humanitarianism in the Age of American Imperialism"
"http://www.theasa.net/","'The Real Heaven on Earth for a True Collector': Redemptive Narratives of Collecting Material Culture"
"http://www.theasa.net/","Imagined Kinship and Queer Families: Neocolonialism, American Studies, and the Personal Politics of Diaspora"
"http://www.theasa.net/","Imagining Community: Museums, Social Media, Democracy"
"http://www.theasa.net/","The After-Image: Frederick Douglass in Visual Culture"
"http://www.theasa.net/","Passing as Post-Racial"
"http://www.theasa.net/","A Light Remix: Film Re-makes and Multiracial “Colorblindness”"
"http://www.theasa.net/","School Desegregation in America's 'Most Segregated' City"
"http://www.theasa.net/","Damsels, Demons, and the Sensationalized South: Ned Buntline’s Civil War"
"http://www.theasa.net/","Oral Ethnography and Queer Generations: Learning from Boots of Leather, Slippers of Gold"
"http://www.theasa.net/","Chicas, Divas, and Dirty Girls: Tranforming Latinidad in the Chica Lit Works of Sofia Quiñtero, Mary Castillo, and Michelle Serros"
"http://www.theasa.net/","'America's role in the war': The OWI, Hollywood, and Military Reparation in WWII Films"
"http://www.theasa.net/","A Chronotope of Mud: Martin Delany’s Blake, the Weekly Anglo-African, and the African American Picaresque"
"http://www.theasa.net/","Semaphoric Texts: The Chappe Telegraph in the Early Republic"
"http://www.theasa.net/","Parlor Tricks: Nineteenth-Century Youth and Early Moving-Image Media"
"http://www.theasa.net/","Mails, Rails, and Armies: The Spectacle of Modernity and the Intimacy of Early Film"
"http://www.theasa.net/","Lavando y Planchando: Puerto Rican Women’s Work and the Development of the Welfare State, 1940-1970"
"http://www.theasa.net/","Venturing Off the Beaten Path: Tourism, Authenticity, and Virility, 1960-1980"
"http://www.theasa.net/","Racialization and Asceticism in Hardcore Punk"
"http://www.theasa.net/","Gilbert Hernandez and the Uses of Iconoclasm"
"http://www.theasa.net/","Personal Style and the Performance of Radical Political Dissent"
"http://www.theasa.net/","Juanita Bynum: Black Religiosity and the Making of a Good Christian Girl"
"http://www.theasa.net/","Vanishing Acts: Black Absence, White Longing, and the Affective Terrain of Reparations"
"http://www.theasa.net/","The Blank Check of History: Mary Francis Berry and Memory Debts"
"http://www.theasa.net/","White Is the New Black: New Genealogies of Subjection in the Conservative Imagination"
"http://www.theasa.net/","Feeling Sorry for Themselves: Ex-Gays, Post-Abortive Women, and Christian Right Compassion"
"http://www.theasa.net/","Gatekeeping Manhattan: Exclusion, Detention, and the Assisted Return of Immigrants in Nineteenth-Century New York City"
"http://www.theasa.net/","The Blackness of Physics: Abstract Embodiment and A Van Jordan's Quantum Lyrics"
"http://www.theasa.net/","Basquiat after Dial: Bridging the Gap between Black Labor and Critique"
"http://www.theasa.net/","Feeling Natural: Affect, Affective Labor, and Colonial Legacies in the Philippine Call Center Industry"
"http://www.theasa.net/","Latina Magazine Has Food Issues"
"http://www.theasa.net/","Liking and Likeness: Across the Color Line in Warhol"
"http://www.theasa.net/","Beyond Tantric Tricks: Racialization of Asians and Asian Americans on Sacred Sex Websites"
"http://www.theasa.net/","Tasting Identities: Food Practices, Music and Identity Choices of Puerto Rican U.S. Colonials in Hawai‘i"
"http://www.theasa.net/","On the Boulevard: Chicana/o Cruisers and the Racial Metropolis, 1965-1980"
"http://www.theasa.net/","Made in the U.S.A.: Fiction and Commerce at the Robe Factory of the Second Ku Klux Klan"
"http://www.theasa.net/","Radio Free Baltimore: Neoliberal Transformation on the Local Public Airwaves"
"http://www.theasa.net/","Sculpture, Performance and Racial Affect"
"http://www.theasa.net/","Darker Than Blue: Chester Himes and Black Visual Culture"
"http://www.theasa.net/","Black Presidents Past: An American Fantasia"
"http://www.theasa.net/","Hark the Noisy Streets: The Nineteenth-Century Sounds of Baltimore"
"http://www.theasa.net/","Everything Is Connected: Syriana, the Oil Encounter, and the War on Terror"
"http://www.theasa.net/","Queer Foreclosure: Limiting Hip-Hop, Framing Black Men"
"http://www.theasa.net/","Barack Obama, Our First Woman President?: Gender Anxiety and the American Dream"
"http://www.theasa.net/","Forming the East-West Center: Hawaii and Cold War Cultural Diplomacy"
"http://www.theasa.net/","Pacific Transformations of Blackness: Blacks Reimagine Race and Belonging in Hawai‘i"
"http://www.theasa.net/","Making the Indian New(s): Popular Print Culture and the Politics of Transformation in the Late 19th-Century"
"http://www.theasa.net/","Locating Political and Psychic Desire in the Prison Town"
"http://www.theasa.net/","Cherishing the Divine Within: Faith and Social Justice in Baltimore, MD"
"http://www.theasa.net/","'To Tie Me to One of My Parts Is to Loose Me': Jean Toomer, Racial Identity and Family Ties"
"http://www.theasa.net/","Passing as Fraud: The Theft of Whiteness in Early Twentieth Century America"
"http://www.theasa.net/","Hannah Elias, Passing, and Racial Identity in Plessy-Era New York"
"http://www.theasa.net/","First [Black] Hair: Strategies of National Universality around Michelle Obama’s Hair"
"http://www.theasa.net/","'Queer for Uncle Sam': Anita's Ambivalent Citizenship in West Side Story"
"http://www.theasa.net/","Imagining Belonging: South Asian Migrant Children as Consenting Citizens of America"
"http://www.theasa.net/","'Canaanites, Cowboys, and Indians' Reconsidered"
